id,title,source,content,link,published_date,sentiment_label,sentiment_score,pipeline_run_time
bmw_4cbf5ce96c7376b6,"Tesla Faces Crisis In Europe, Loses Ground To Volkswagen, And Sees Sales Decline In Strategic Market - CPG Click Petróleo e Gás",Automotive News - Competitors,"Tesla Faces Crisis In Europe, Loses Ground To Volkswagen, And Sees Sales Decline In Strategic Market - CPG Click Petróleo e Gás. Tesla Faces Crisis In Europe, Loses Ground To Volkswagen, And Sees Sales Decline In Strategic Market CPG Click Petróleo e Gás",https://news.google.com/rss/articles/CBMi8AFBVV95cUxQTHltczJEekZ5Rk1weDM3MS1iU0U2RFhOako5UlpzLXhxYWVPd0V2LUdUbEJUc0VvdXN2OXd4YUVVbzlhd2oyTlJ0ME1hbDhZVS1qUWtYTTgycV9oVThBRU1EWjZpa0ZWY2RHUzBJelN4RHpBb1NvRmN5d05kaGtJTnR1VzVqU0hZcnNibkJicXB3WWRCYUlfNy1MOEZJVzhNcjhsX1RwdVhkdUFkVlItTUt0NWhXcGxVMjA4dUpXY3BHb1JpLWlVbUFQakNrZWt1MDFtS0ljcUdGTFd4S0FublUtWWxLelBiNjZlOUZwTDY?oc=5,"Wed, 11 Feb 2026 08:00:00 GMT",NEGATIVE,0.9995,2026-06-23 00:14:45
bmw_d9b83f0cc65dc218,How BYD Harnessed Strategic Procurement To Become Top Seller - Procurement Magazine,Automotive News - Competitors,How BYD Harnessed Strategic Procurement To Become Top Seller - Procurement Magazine. How BYD Harnessed Strategic Procurement To Become Top Seller Procurement Magazine,https://news.google.com/rss/articles/CBMiiAFBVV95cUxOWFNTLUZ4Q0pPLTBmbWJDSUgtNlVVMEVMaFQ0Qm02MHh6UGxERklveTh0cm5qZEc5OEd0T1lORUVNUERBbUJ2cGdkWDJISU1PeURUMnZSX2pSNDN0RlYyWGxmVmk5VGpOWGRIemVrb2Y2X0x5UmRUc24yLWtmUElLREkySWZCS0N4?oc=5,"Mon, 01 Sep 2025 07:00:00 GMT",POSITIVE,0.98,2026-06-23 00:14:45
bmw_591b74fc3dcdd622,Tesla's India Journey Faces Reality Check: Orders Fall Short of Expectations - ACKO Drive,Automotive News - Competitors,Tesla's India Journey Faces Reality Check: Orders Fall Short of Expectations - ACKO Drive. Tesla's India Journey Faces Reality Check: Orders Fall Short of Expectations ACKO Drive,https://news.google.com/rss/articles/CBMipgFBVV95cUxNanJBTnhpYzFhZFdudmp5M3dBTl95YV84Vm40V2dBT2VKYXZtRnJCZUdOMmVqNUZLWGk3X2MtWHp3OXMwVjk4SGhtdFRQejlFZEhNOHc1aS0xcnF3VnVNMkVtTHI5RjAxTHlveDhhTnpiU0Y2RHJWV0xmVnNkUlN2UjdISHlVNnVCY1U1anFlSXRNRGZqUEo2MzRpV2lQdWkxZ2xjQktB?oc=5,"Tue, 02 Sep 2025 07:00:00 GMT",NEGATIVE,0.9966,2026-06-23 00:14:45
bmw_7736fe31cd740baa,Mercedes-Benz Group stock (DE0007100000): focus shifts to EV strategy after first-quarter 2026 earni - AD HOC NEWS,Automotive News - Competitors,Mercedes-Benz Group stock (DE0007100000): focus shifts to EV strategy after first-quarter 2026 earni - AD HOC NEWS. Mercedes-Benz Group stock (DE0007100000): focus shifts to EV strategy after first-quarter 2026 earni AD HOC NEWS,https://news.google.com/rss/articles/CBMiwwFBVV95cUxQcVdmQ05hY1h4UG0yNDd0ZUhtTkJfRV9kY0NZWHY5S1RVaGMxTEpPbmllcHhfQTRHQUQzbndEazJpQ2tIZGcwQ1Roc3JPSWt2ZjEwamU3Ry1KOHFGTU1KVHk1MmtRWWM4OVpJd00yX0dROW5qRDBvYTNVblVrQjZrSEMyR1F6eW85cW9tMGExQS0wTmk4VUR1WEZ4Rnh0SU1GMHExR3F4NFM4MEJxTTJUN0JSZ2dROWlZakxUVmVpZkluUnc?oc=5,"Tue, 19 May 2026 07:00:00 GMT",NEGATIVE,0.9467,2026-06-23 00:14:45
bmw_114a0bc43340dc77,Tesla plans 6-seat version of Model Y to reclaim lost market share in China - South China Morning Post,Automotive News - Competitors,Tesla plans 6-seat version of Model Y to reclaim lost market share in China - South China Morning Post. Tesla plans 6-seat version of Model Y to reclaim lost market share in China South China Morning Post,https://news.google.com/rss/articles/CBMitwFBVV95cUxPeEZzQXRMWmtub2I3eUNOUXFjS1FuSUsyODFYXzN1UHJnVVgwWGVDMVpIUlU5SXpVeGRrc2JFS050UDIzUnFveUNBRlJCUUgzN0l4M1Nvdi16dmtxM0UzYUNYVk5remc3QkN2Tzg0YmItWE55dnBVdjA4UUp3bUFuVWhYdWEyYUZJZllJZ2s0RXZESl9kbXh1Y0NzWVQ2RnBQUXhHcEd6TTJNZHpfa0U1QVNtMThrX1nSAbcBQVVfeXFMTTAySDMyVzh3cU5obTNjc1QwYXp2ZENKX21rTGJSUUhsTXoxRzZjOE9WYjNtTF9HNk1VanRlS1VnQzQtOHRybzNQVFIwUF9CelNHYktFVjYtcFJKRXJjS1lVVlJIZlFUSzVuci1UVUNPVzNOREwxODZsaUFHSU9zR0ktRldLZlgxTlllYnMyUU9nZzVDUTBKX0J3UzdveU1ONE9wRXlxVTIySjI1alZURmNMZGdXbmZj?oc=5,"Thu, 17 Jul 2025 07:00:00 GMT",NEGATIVE,0.9989,2026-06-23 00:14:45
bmw_18fe97837e84b0bd,Tesla's Affordable Model Y Strategy Involves Indian Auto Component Suppliers - scanx.trade,Automotive News - Competitors,Tesla's Affordable Model Y Strategy Involves Indian Auto Component Suppliers - scanx.trade. Tesla's Affordable Model Y Strategy Involves Indian Auto Component Suppliers scanx.trade,https://news.google.com/rss/articles/CBMi0gFBVV95cUxNbWs3OVBfSjhCUnNXNlF0UUV6N0d6cm9NejdIZkIwdXJTMFhIcy1TMG05LWNwcWNuekJUWEFOaXhkUWYwdmdoM0EzZ3hvZUE4Q0l6aGptNGxrV1l0NTFXb0l4VDhVZE51Zm40b0V5UnlHNW9TQ3hGcndKMHAybnBFRlZZcHVNTXprNW1meE8tQy1kYmxNNmljanFrWGRycUVVZVRJVXR1SFF3MU9JTTdDOU9MRDFsZUttQncyc0l5ZzFiSzFTakZDSk1YMkpEU0dEZXc?oc=5,"Mon, 06 Oct 2025 07:00:00 GMT",NEGATIVE,0.6309,2026-06-23 00:14:45
bmw_b1506ce3f9e6e2f7,Tesla's Strategic Pivot: From Auto Maker to AI and Energy Powerhouse - AD HOC NEWS,Automotive News - Competitors,Tesla's Strategic Pivot: From Auto Maker to AI and Energy Powerhouse - AD HOC NEWS. Tesla's Strategic Pivot: From Auto Maker to AI and Energy Powerhouse AD HOC NEWS,https://news.google.com/rss/articles/CBMixAFBVV95cUxOUnZUMUVzdGV5SjVOaW9XRE5DeDNyTGh0Z2pvY015WFJSbW1qTVVQRDNSX092ZS1sUUN1ZGdnTGd5a3BjaUNBbk5McU9ZSVY0NUZHQzU3Tks4aWlpbFZ4c2E0WURTMGx3VlRnaXdDMk9abUc1U0taSnE5QmtiZTk1dTM5Wi1FZzVaRl9zTFJWLVBTZWthZnBtT0hpajZlYUJXRmw2Tm1lc21qbUcxMnM3cXJOMjFKeUtDS2RtUXltVWx3Qm1U?oc=5,"Thu, 12 Feb 2026 08:00:00 GMT",POSITIVE,0.9912,2026-06-23 00:14:45
bmw_14da2f34150958e4,U.S. Electric Vehicle Sales Increase More Than 10% Year Over Year in Q1: GM Drives EV Growth While Tesla Declines - Cox Automotive Inc.,Automotive News - Competitors,U.S. Electric Vehicle Sales Increase More Than 10% Year Over Year in Q1: GM Drives EV Growth While Tesla Declines - Cox Automotive Inc.. U.S. Electric Vehicle Sales Increase More Than 10% Year Over Year in Q1: GM Drives EV Growth While Tesla Declines Cox Automotive Inc.,https://news.google.com/rss/articles/CBMiaEFVX3lxTE1JOWtrMTZpUE5YcERSd0hfM2JpNGlNSFQwcDI5VFV2Sk9DMFVDZGNSb0hUcTUzSFN6eTFrYmVCNTFTWERkOFl1ZlU4UlZWcHJrQ3IweGR0dTlaRUowMnVCTHpUTUxla3Mx?oc=5,"Thu, 10 Apr 2025 07:00:00 GMT",NEGATIVE,0.9913,2026-06-23 00:14:45
bmw_6456760ac5f8701c,What are New Zealand's top EVs and PHEVs right now? The numbers are in - Driven Car Guide,Automotive News - Competitors,What are New Zealand's top EVs and PHEVs right now? The numbers are in - Driven Car Guide. What are New Zealand's top EVs and PHEVs right now? The numbers are in Driven Car Guide,https://news.google.com/rss/articles/CBMiqwFBVV95cUxOZG85NkxSc1FZSkMzS2podGp2eVpnYTMtTnFBM3FMdFNlcnpZZE5DUHpxdzhfV3ZKaUZrVHRXN29ISHFLUExuSEVRVFNiaWFsYVdqbVMyWTJfYUsxcHFGRlNTM09IN29mU3FiUUk5cnNfdnlGYUNIcVlVbTNiOTZIV2tQdmVZWllrS09Zc3Q3b0QzNVJJbGxfcHhsSGtEaHpaVlY0Wk5XNlBIa2M?oc=5,"Thu, 15 Jan 2026 08:00:00 GMT",NEGATIVE,0.9793,2026-06-23 00:14:45
bmw_f5d87663b3de7210,BYD Overtakes Tesla in Global Electric Vehicle Sales for 2025 - Discovery Alert,Automotive News - Competitors,BYD Overtakes Tesla in Global Electric Vehicle Sales for 2025 - Discovery Alert. BYD Overtakes Tesla in Global Electric Vehicle Sales for 2025 Discovery Alert,https://news.google.com/rss/articles/CBMikwFBVV95cUxQYVQ3Njh2MXlBQVNqbVJncTdSUmJUQkpYV1pCT3d4N1NHN2FxaTgyNU1OcV9FdnhqNkROamxfYWxDR2RKVU5LZXFPMklvckl4V3pfb3lBTHlBYWRidGpKVE1IUEt1TjNEMW00ZlRmSVVGVEVndGt6RHQweEVfVW5PUkR2REl0RWVkOUc2eEgtbGYxUEE?oc=5,"Mon, 05 Jan 2026 08:00:00 GMT",NEGATIVE,0.9908,2026-06-23 00:14:45
bmw_bc6f685ecb217418,"Customer should decide pace of EV transformation, won’t chase targets: Mercedes-Benz India CEO Santosh Iyer - ET Auto",Automotive News - Competitors,"Customer should decide pace of EV transformation, won’t chase targets: Mercedes-Benz India CEO Santosh Iyer - ET Auto. Customer should decide pace of EV transformation, won’t chase targets: Mercedes-Benz India CEO Santosh Iyer ET Auto",https://news.google.com/rss/articles/CBMi3wFBVV95cUxOUi1aTGtZbXRBSU9tZDlsT3Q2SXVRcm9XT3loUWRBck16QzhuSjRqS1pfS0ZiUmFCRTVleEZ4b2M1NXBYN2pHYUV4Yi1LTG14UHg2UEN5cUJvaDFydU4zeS1KMXotS2RxTTlTWlNyWldseVRGckQ3VVlLN2RHeGpidHlGS21FUWFRZ094VTBEMUR5Z1NwMnpLLWgxUWxPczdRTU1SR2JqR2FWUEQyeUM5dnVCYkpwTUhPUnJVR3lDaHYxdXBOM01tVXhiR0FyZmVoRzROWVViNjZvSkRWOVVJ?oc=5,"Tue, 07 Oct 2025 07:00:00 GMT",NEGATIVE,0.7919,2026-06-23 00:14:45
bmw_ac9fdf8927946b82,Tesla sacrifices to stay ahead of rivals in EV race - marketplace.org,Automotive News - Competitors,Tesla sacrifices to stay ahead of rivals in EV race - marketplace.org. Tesla sacrifices to stay ahead of rivals in EV race marketplace.org,https://news.google.com/rss/articles/CBMinAFBVV95cUxQSzdGRG9DZTRaaHBjaUREWnhYRzlRZ3Fic3RNejNpUEdpSWJadjNoTkd5YUg3alkyUkxnTVp5ZzdsT2EzMmNNZm1URWpnV2dJalFkQ0U4ZXE3djdpb0VfSVdiR1Q0SGo2akFBSlZtUVk4OGNRanFXY1JfZFUzMURCTlB2NEhmRHJtZkxfWGFkcmllMmMwcGlpUWJTVVc?oc=5,"Mon, 16 Oct 2023 07:00:00 GMT",NEGATIVE,0.8275,2026-06-23 00:14:45
bmw_3f50be5d1002b728,Growth Trends in the Plug-in Hybrid Electric Vehicle (PHEV) - GlobeNewswire,Automotive News - Competitors,Growth Trends in the Plug-in Hybrid Electric Vehicle (PHEV) - GlobeNewswire. Growth Trends in the Plug-in Hybrid Electric Vehicle (PHEV) GlobeNewswire,https://news.google.com/rss/articles/CBMi1wJBVV95cUxPSEswRHE4bkZEUDNEM0Z0cXM1dk9KRE5OVmVGLVc4azFoaXRQVkZIWW5RZ3FqRVNFSjNsb012dFpKWXlma1NyejZHSTRqb3hRdk1tUXJ4RjNjMVNlenIxSDhEdVNkRVNzOFFZdWRtcHNlbmUwMmNhbGVCUUgwaTYyZFVvcXhwYnY0dnVLWGlFRWZ1S0I0YmFFbGRjR3hMLWllRDVjaUN5RjNxU25TanR6MEQ4TXVRQzFlUVl1dlV2NWlnbnVQQlVicnF2RE82Q2dpRE91S29KQmVFZjE3dFJDWFhnbnlMUnVSNnNCTkZqOGw5R3VtdGw0a1VBS1RaSjRwYjVpNzA3VUYzNE5aNGg2bkp6T1g2ZkNaUkNCcDU3Y05CRmVwN1loMmJ6VTNDaUVORHZuT2hYZkFrMktlNmp4bExoOERKU3FXYWNUbmdjWU10VkhNbUxz?oc=5,"Fri, 24 Jan 2025 08:00:00 GMT",POSITIVE,0.9876,2026-06-23 00:14:45
bmw_191a5860faad0138,Why Tesla is losing market share in Europe: sales drop over 30% in Q1 2025 - EVBoosters,Automotive News - Competitors,Why Tesla is losing market share in Europe: sales drop over 30% in Q1 2025 - EVBoosters. Why Tesla is losing market share in Europe: sales drop over 30% in Q1 2025 EVBoosters,https://news.google.com/rss/articles/CBMiswFBVV95cUxNak1hZ3ZXalBNbG5acFQwRlNMQjdvSUtmX3J3WEtCS1o0SnV4RGNTWlVaZGppWjU1T0pnLUdxVnFid19JaWJjSTV2eEdERTFOWWpXd0wtemJNa3Zwb2dNdEp2WjIwbnV6VXJRTVoxS3luRzA2ZlU2NjVJQWk3WS1UVVI5YkJrMTFxdnd0LXFaYVdjMkNaU3QxMF90cjF4cXZVOW5TRkozYnZtS08tcHgwSm1rVQ?oc=5,"Tue, 22 Apr 2025 07:00:00 GMT",NEGATIVE,0.9997,2026-06-23 00:14:45
bmw_a20c72655a916c08,"VW, Audi expand into China with SAIC and Xpeng partnerships - Automotive Manufacturing Solutions",Automotive News - Competitors,"VW, Audi expand into China with SAIC and Xpeng partnerships - Automotive Manufacturing Solutions. VW, Audi expand into China with SAIC and Xpeng partnerships Automotive Manufacturing Solutions",https://news.google.com/rss/articles/CBMikAJBVV95cUxOaXVqU1A0QnBvYlNUYUIxQzE3TUJRWkg1elU2VW9hTVFTRU9ETXNmMXJpWDQ5bFJfVC1kZDk2OUp3NTQ3ZDRGWXRaRDQ0eDRCdkpyZndaX1BQWWFuSjdZQWROeTVsd0UwNVdiclo0dHlBcGVaSlpVODhNM2I5WDRhaHdsemc3Qk5yQ3pvWndrT0lianBjRlJwUm5QU3E3VEVtTmFoSENES2V5RVBkaDlSV1V6LVA4SmVFcWw5VWZVbDdPWVRPdXFlN0F3MjNPNWNHWGR5UjkxTFBzNDNQTFlUR25BOGhUSzVJNnZvWVRnMnAxUW5vT25IaklrRTJuQjNIR1UtdURDYVhtc2ZlVnBjZw?oc=5,"Fri, 04 Aug 2023 07:00:00 GMT",POSITIVE,0.9967,2026-06-23 00:14:45
bmw_2b4134c900fa486d,"Mercedes-Benz car sales drop as China, EV slump take toll - The Business Times",Automotive News - Competitors,"Mercedes-Benz car sales drop as China, EV slump take toll - The Business Times. Mercedes-Benz car sales drop as China, EV slump take toll The Business Times",https://news.google.com/rss/articles/CBMiwgFBVV95cUxNd2JiRVFfYWVKWEFGQUZCMk1hWXR0TkphZllXNnhlVFhyTUV5WHB1OTgtdGoxbDdmc3Vyc3AzVjBFbGxaY3FOMmptRnVDQWlydXRLb0lGRTNKM2s5ZU14bGd5X0Fua2NHZ1JkaGNjSmZmeVJmdHM5U1pzNkV0OHRSTzRaLWwzX3hMS1VfOUFlWHFRY2IwQmRlV1A2SndvbE42WHlmSEZpbkJuelU4WU15UnFja1VCTm1IbVppZVdaa3BSUQ?oc=5,"Fri, 10 Jan 2025 08:00:00 GMT",NEGATIVE,0.9991,2026-06-23 00:14:45
bmw_1c48119453727e39,Audi calls for state support amid industry woes - Business Day,Automotive News - Competitors,Audi calls for state support amid industry woes - Business Day. Audi calls for state support amid industry woes Business Day,https://news.google.com/rss/articles/CBMitAFBVV95cUxOalN6VG5oU2dSVmtZcVRyX0dmRWIyNHVDN0hXWDF6eENONEZYQXF1N1huZHl5ZDFYejVTbVdCZDRjX1JjLWlTN1o5UERZV1JDNjRSeV9hLWFPMmQ2ejhiSGM2QzltTDViRkg0UHZIU19OdDhtYldmYzROUThHdUM5Yl85aWFsRHpkN3hCU1ZiNnN4b2dIM29hdXEwQzBWMWZGQ0tpQU8zZ2pXeDg5SUpNS0NLY0E?oc=5,"Thu, 17 Apr 2025 07:00:00 GMT",NEGATIVE,0.9891,2026-06-23 00:14:45
bmw_149fb85c62348626,Audi India’s Slide from Glory: Has German Luxury Carmaker Lost Grip on Indian Market? - Republic World,Automotive News - Competitors,Audi India’s Slide from Glory: Has German Luxury Carmaker Lost Grip on Indian Market? - Republic World. Audi India’s Slide from Glory: Has German Luxury Carmaker Lost Grip on Indian Market? Republic World,https://news.google.com/rss/articles/CBMivgFBVV95cUxNaHVvVVhWNGtpeWh1Y1lleGtWOG1zTUlnMW5ZNmNlSGo4Q1d2WnpwRDRSSWVyM3lWTkpfcEw4MjhUMDFQdW55QUxaakMwcVJlOTRuNFdKSElFU3BtUV9xc1VvX3hfTjBYRUl1NnBpQ0dONUhTblpndUFfekZQUjVQR2Iwa0xUa0pKb3NxWjVrdDNBTnNMeUFEemZNRTdhaDVOQ0I4TzRjWnl3RnFFVG9aM21Vc05TMnZXYzNsaEdn0gHDAUFVX3lxTE5kZnhUenRWcEdFOE5Zd1FNRXZzc2FRZlB3cWRkRGxPd0l2OGhPM3NackVDNkhfdXZFdU1CbUp3aXBRZWNSLUJXRndfcnFSQXhYcE1yV1E1X21yVGZVLXlNanBuZVJpVTFCOERSMU8yRzdUaFR5a203NXR3SW43WU83UlNSZWhsODd5dDhfZlpkQzV5ZlZzc3dTVlZGazVuTHA0Z3g0UURHUWo1Y0hIOEtwMjh4X3F1WkktR0hhNEh4YUxRQQ?oc=5,"Fri, 31 Oct 2025 07:00:00 GMT",NEGATIVE,0.999,2026-06-23 00:14:45
bmw_923462cc6a9e5e73,"UK Electric Vehicle Market Size, Share & Growth Report 2034 - Market Data Forecast",Market Intelligence - EV Trends,"UK Electric Vehicle Market Size, Share & Growth Report 2034 - Market Data Forecast. UK Electric Vehicle Market Size, Share & Growth Report 2034 Market Data Forecast",https://news.google.com/rss/articles/CBMikgFBVV95cUxOcG55NWx5ZFFjNnZvTjJBZjBTTTFKajZpVkg0UFlkZF9GYkxXa0s0elAwREgzZkRSZ1gtaG1RVkkxMnVpd2hoNktKbWRqXzJCakdZc2hWeDg5ZjVxSEttcDl3ck1DTk5PU1h6bFpDUmlyNTRXY1doZzYwdDNNVFA5UllsUXlvYkxsb2FYQXlVb2tBdw?oc=5,"Tue, 09 Jun 2026 07:00:00 GMT",POSITIVE,0.9665,2026-06-23 00:14:45
bmw_aac761f997b06843,New-Inventory Holds Steady Amid Mixed Market Signals - Cox Automotive Inc.,Market Intelligence - EV Trends,New-Inventory Holds Steady Amid Mixed Market Signals - Cox Automotive Inc.. New-Inventory Holds Steady Amid Mixed Market Signals Cox Automotive Inc.,https://news.google.com/rss/articles/CBMif0FVX3lxTFBBTDNJcEE1YnBjd0VuQVE3bmE1Nlc0UjBpQ2VWaGVGTEMtYVNZNk5kRkJiQkNCYjBicGVJV3Jjc2l1U3NvT0MwMERiS2RGQmhCSnA2VW9SaFM5aFFPcVM0OTdINlRlaEptaDk4eHZjV2pleWV5UGdxZXh1NXVPVjQ?oc=5,"Thu, 11 Sep 2025 07:00:00 GMT",POSITIVE,0.8824,2026-06-23 00:14:45
bmw_23cdb9ff62652604,BMW E92 M3 awesome view,Reddit BMW,"BMW E92 M3 awesome view. Not my car, but this shot from the meet was just too good not to share &#32; submitted by &#32; /u/No-Judge9468 [link] &#32; [comments]",https://www.reddit.com/r/BMW/comments/1ucu44t/bmw_e92_m3_awesome_view/,2026-06-22T19:20:19+00:00,NEGATIVE,0.8053,2026-06-23 00:14:45
bmw_97b0c3760ed18583,I Spent a Week With the BMW M2 CS and It Might Cure Depression,BMW Official Pressroom,"I Spent a Week With the BMW M2 CS and It Might Cure Depression. BMW is a car company. That should be obvious by now, but I was not aware that BMW was in the pharmaceutical business. A week with the 2026 M2 CS revealed they have created a... First published by https://www.bmwblog.com",https://www.bmwblog.com/2026/06/22/bmw-m2-cs-2027-review/,"Mon, 22 Jun 2026 19:20:32 +0000",NEGATIVE,0.9117,2026-06-23 01:12:01
bmw_689eeee5d8e69a0a,Leipzig Plant Just Got a Big Clue About New Electric BMWs,BMW Official Pressroom,"Leipzig Plant Just Got a Big Clue About New Electric BMWs. BMW&#8217;s Leipzig plant is going dark for five and a half weeks this summer, and when it comes back online, it&#8217;s rumored to be wired for the Neue Klasse. Plant manager Petra Peterhänsel confirmed the... First published by https://www.bmwblog.com",https://www.bmwblog.com/2026/06/22/bmw-leipzig-plant-neue-klasse/,"Mon, 22 Jun 2026 18:05:06 +0000",NEGATIVE,0.9977,2026-06-23 01:12:01
bmw_b0b719290e1f8f33,BMW M3 vs M4: Which One Should You Actually Buy?,BMW Official Pressroom,"BMW M3 vs M4: Which One Should You Actually Buy?. M3 or M4? On paper, the answer should be easy. One is a sedan. One is a coupe. Buy the one that works best for you. But, as with most things in life, it isn’t... First published by https://www.bmwblog.com",https://www.bmwblog.com/2026/06/22/bmw-m3-vs-m4-which-one-should-you-buy/,"Mon, 22 Jun 2026 18:01:37 +0000",NEGATIVE,0.9992,2026-06-23 01:12:01
bmw_1a7a9e1ea8e874ff,The New BMW i3 Is Longer And Wider Than The Outgoing 3 Series,BMW Official Pressroom,"The New BMW i3 Is Longer And Wider Than The Outgoing 3 Series. If you’ve been hoping car bloat would somehow suddenly come to an end, we’ve got bad news for you. The new i3 is larger in every dimension than the outgoing 3 Series, and logic suggests... First published by https://www.bmwblog.com",https://www.bmwblog.com/2026/06/22/bmw-i3-longer-wider-outgoing-3-series/,"Mon, 22 Jun 2026 13:23:26 +0000",NEGATIVE,0.9983,2026-06-23 01:12:01
bmw_f830f434fe0ab4d5,MINI Dresses Up Its Cars For The 2026 World Cup,BMW Official Pressroom,MINI Dresses Up Its Cars For The 2026 World Cup. Germany’s 2026 World Cup campaign is off to a strong start. It demolished Curacao 7-1 in its opening match and followed that with a 2-1 win over the Ivory Coast. Even before facing Ecuador on... First published by https://www.bmwblog.com,https://www.bmwblog.com/2026/06/22/mini-2026-world-cup-livery/,"Mon, 22 Jun 2026 12:05:52 +0000",POSITIVE,0.9984,2026-06-23 01:12:01
bmw_8262863946d08941,2026 BMW iX3 M Sport First Edition Is Coming To A Single Market,BMW Official Pressroom,"2026 BMW iX3 M Sport First Edition Is Coming To A Single Market. It was only a few days ago that BMW launched the i3 First Edition to give the electric sedan an early start in Europe. Now, its SUV counterpart is getting similar treatment. This time, the... First published by https://www.bmwblog.com",https://www.bmwblog.com/2026/06/22/bmw-ix3-m-sport-first-edition/,"Mon, 22 Jun 2026 11:06:10 +0000",POSITIVE,0.6176,2026-06-23 01:12:01
bmw_edce85246e7945f6,"We Caught the Facelifted BMW M5 Testing, Here’s What It Reveals",BMW Official Pressroom,"We Caught the Facelifted BMW M5 Testing, Here’s What It Reveals. Two facelifted BMW M5 prototypes, the G90 sedan and the G90 Touring, were spotted testing near the Nurburgring this week, both wrapped in heavy camouflage but clearly running updated bumpers, lighting elements, and trim pieces... First published by https://www.bmwblog.com",https://www.bmwblog.com/2026/06/21/bmw-m5-facelift-prototypes-spotted-nurburgring/,"Sun, 21 Jun 2026 18:26:33 +0000",NEGATIVE,0.9716,2026-06-23 01:12:01
bmw_f01825da00b48c83,The Man Who Approved the BMW 1M Kept the Rarest One,BMW Official Pressroom,"The Man Who Approved the BMW 1M Kept the Rarest One. Wheels &#38; Weisswurst is not a normal car show. Show up at BMW Group Classic&#8217;s Munich headquarters on Moosacher Strasse on one of the first or third Saturdays between May and September, and the reward... First published by https://www.bmwblog.com",https://www.bmwblog.com/2026/06/21/bmw-1m-monte-carlo-blue-individual-interior/,"Sun, 21 Jun 2026 17:39:23 +0000",POSITIVE,0.5049,2026-06-23 01:12:01
bmw_a9fdb4cc28efd4eb,BMW’s New Electric Coupe-SUV Just Showed Its Shape Near the Ring,BMW Official Pressroom,"BMW’s New Electric Coupe-SUV Just Showed Its Shape Near the Ring. A camouflaged prototype of the upcoming BMW iX4, internally codenamed NA7, was spotted testing near the Nürburgring, and the swirly wrap isn&#8217;t hiding much. The roofline kicks down hard behind the B-pillars, the rear end... First published by https://www.bmwblog.com",https://www.bmwblog.com/2026/06/20/bmw-ix4-na7-spy-shots-nurburgring/,"Sat, 20 Jun 2026 17:25:02 +0000",NEGATIVE,0.9986,2026-06-23 01:12:01
bmw_5af15c25e060e280,"This €370,000 Zagato Is Secretly a BMW M4 With 602 HP – First Drive",BMW Official Pressroom,"This €370,000 Zagato Is Secretly a BMW M4 With 602 HP – First Drive. The Bovensiepen Zagato is not exactly what you&#8217;d call attainable. Only 99 will ever be built, and Bovensiepen says production will be capped at 30 cars per year. In Europe, they will cost €310,000; when... First published by https://www.bmwblog.com",https://www.bmwblog.com/2026/06/20/bovensiepen-zagato-first-drive-review/,"Sat, 20 Jun 2026 15:07:53 +0000",NEGATIVE,0.9981,2026-06-23 01:12:01
bmw_07a1f253d1312451,BMW’s Rare New Wagon Loses Most Of Its Camouflage,BMW Official Pressroom,"BMW’s Rare New Wagon Loses Most Of Its Camouflage. When someone says BMW doesn’t know how to build a beautiful car anymore, point them to these images. While looks are subjective, it’s hard to find a bad angle on the Speedtop. Fresh spy photos... First published by https://www.bmwblog.com",https://www.bmwblog.com/2026/06/19/bmws-rare-new-wagon-loses-most-camouflage/,"Fri, 19 Jun 2026 12:14:41 +0000",NEGATIVE,0.9987,2026-06-23 01:12:01
bmw_caa6805987bac235,Does It Fit? 2026 BMW i3 Front And Rear Trunk Sizes Revealed,BMW Official Pressroom,"Does It Fit? 2026 BMW i3 Front And Rear Trunk Sizes Revealed. When BMW phased out the i3 hatchback in 2022, it repurposed the moniker for an electric 3 Series sold in China. The EV was based on the locally produced long-wheelbase (G28) model and used the... First published by https://www.bmwblog.com",https://www.bmwblog.com/2026/06/19/2026-bmw-i3-frunk-trunk-size/,"Fri, 19 Jun 2026 11:03:55 +0000",NEGATIVE,0.9923,2026-06-23 01:12:01
bmw_595f7dcacefca7a7,BMW i3 Specs Released: Here’s Everything You Need To Know,BMW Official Pressroom,"BMW i3 Specs Released: Here’s Everything You Need To Know. When BMW revealed the new i3 back in March, the premiere was more of an appetizer ahead of the main course. While the images showed the electric sedan inside and out, technical specifications remained largely... First published by https://www.bmwblog.com",https://www.bmwblog.com/2026/06/19/2026-bmw-i3-specs-details/,"Fri, 19 Jun 2026 10:12:22 +0000",POSITIVE,0.8567,2026-06-23 01:12:01
bmw_b717ed4b3fe7ddd7,BMW Pulls Three China-Built EVs to Make Room for Neue Klasse,BMW Official Pressroom,"BMW Pulls Three China-Built EVs to Make Room for Neue Klasse. BMW Brilliance Automotive will reportedly end local production of two CLAR-based electric models, and one FAAR, in Shenyang this July. The iX1, the China-spec G28 i3 sedan, and the long-wheelbase i5 are all on the... First published by https://www.bmwblog.com",https://www.bmwblog.com/2026/06/18/bmw-clar-ev-production-china-neue-klasse/,"Thu, 18 Jun 2026 22:51:46 +0000",NEGATIVE,0.9972,2026-06-23 01:12:01
bmw_d3743ee307b6246e,"Why the New 2027 BMW X5 Can Be Gas, Diesel, Hybrid, Electric, or Hydrogen",BMW Official Pressroom,"Why the New 2027 BMW X5 Can Be Gas, Diesel, Hybrid, Electric, or Hydrogen. BMW will sell the next-generation X5 with five different powertrains in the same body, and according to the Head of Project Michael Ahlers, that was the entire point of the project from day one. We... First published by https://www.bmwblog.com",https://www.bmwblog.com/2026/06/18/bmw-x5-g65-five-powertrains-chief-engineer-interview/,"Thu, 18 Jun 2026 16:23:50 +0000",NEGATIVE,0.9726,2026-06-23 01:12:01
bmw_363b1c6b0bfc1f39,Agentic AI is part of our daily business - BMW Group,Google News - BMW Corporate,Agentic AI is part of our daily business - BMW Group. Agentic AI is part of our daily business BMW Group,https://news.google.com/rss/articles/CBMibkFVX3lxTE9CVHVJb2ttSlNrT1hFX2pnQmFxYTcxUmppZ0JjbjV0RUFZRGpjVDdCMy1oTFpyTGNKUlN0VFpiQlEtZTAzMVVqUmdRRkltRHdUTHM3U3h6b2stRmlUWjJIYW94TFNjSHYyWXduRDVR?oc=5,"Fri, 22 May 2026 08:13:05 GMT",POSITIVE,0.9735,2026-06-23 01:12:01
bmw_a933eac6e2881aca,BMW Group - Forbes,Google News - BMW Corporate,BMW Group - Forbes. BMW Group Forbes,https://news.google.com/rss/articles/CBMiVkFVX3lxTE9JZ0IyY0Y3SlNSX2pRWUs1NVI2LWxNRlJITEI3d0RZdndOb3FjeDN5VlpjTDZzNUxERWFBVlZkbTI4N3ZGcVQ2SzRHd0JfbHRsSW5jaDVB?oc=5,"Tue, 19 May 2026 07:00:00 GMT",POSITIVE,0.9256,2026-06-23 01:12:01
bmw_361a3f1d2ce4be38,BMW Study Reveals Minimum EV Range Business Drivers Want - bmwblog,Google News - BMW Corporate,BMW Study Reveals Minimum EV Range Business Drivers Want - bmwblog. BMW Study Reveals Minimum EV Range Business Drivers Want bmwblog,https://news.google.com/rss/articles/CBMikAFBVV95cUxOQmN6bXJRN3otdEJoTUp2aFJoQmNjZGxBVTFaSnJCampaUDliTDlxc1d2ZE9TLWpfeWpGNlhEVEVJM3VSWDFjRVp5WTVVWm50V2xxalB5b21OcHBGSmNpZkU4cHpCeW9ZTm5wRjdjeFo0RUJNS1lmTklvLXo1b0VWV0FoUWgyUDUzMmNJNUFzSHM?oc=5,"Sun, 15 Feb 2026 08:00:00 GMT",NEGATIVE,0.8635,2026-06-23 01:12:01
bmw_31b48c5fe7c4b5d7,Stable Group earnings thanks to consistent strategy: BMW Group on track - BMW Group,Google News - BMW Corporate,Stable Group earnings thanks to consistent strategy: BMW Group on track - BMW Group. Stable Group earnings thanks to consistent strategy: BMW Group on track BMW Group,https://news.google.com/rss/articles/CBMi4AFBVV95cUxQSm10RzY1WWFNc3pUTE5uUERjNl91cExFa2wzVmIxQVBTdmpEMGlTOV9mbDlNaDhqOFJlZ1pnUUlYcmFxaTYyLUV0RTdqei1JZUpLX1ZlYlNOV3ZYcG9BU010Nk1jUndzS1hxMFpGVDA0RmEtZTBiUHdUYWQwRTVoQWVHTXB3YnVZU1Z4anVtN1EzU1hvNjFqRDg1V05IdDkzTEdWNVFnZ0t1bW4wNFA3eUVVWTBIMkdGb1ExclBnQ1JZekpIM2lXUV9HaFlVUHMwVEM2ZVZac2s5VU5EanZwRw?oc=5,"Thu, 12 Mar 2026 07:00:00 GMT",POSITIVE,0.9997,2026-06-23 01:12:01
bmw_6245bd848de69e78,BMW names new Americas boss for Mini - Automotive News,Google News - BMW Corporate,BMW names new Americas boss for Mini - Automotive News. BMW names new Americas boss for Mini Automotive News,https://news.google.com/rss/articles/CBMidkFVX3lxTE1hUnpYVEdaX1pRb3JrMmJja2IyUFlOeFVjMDQzbHRHRGJ5UmVDeVhjLWlKWVYyRmxuVW5iZWZMQm5iNzhneGh1TFJmVlNac01lSW15VmVOZmsyWG1KY0ZGOGRLaFZrRGVacE5XU29fUC12S3IwRVE?oc=5,"Mon, 23 Feb 2026 08:00:00 GMT",POSITIVE,0.9401,2026-06-23 01:12:01
