id,title,source,content,link,published_date,sentiment_label,sentiment_score,pipeline_run_time
bmw_3867d6709c6261cc,"Audi Automotive Statistics By Market, Sales And Revenue (2026) - Bayelsa Watch",Automotive News - Competitors,"Audi Automotive Statistics By Market, Sales And Revenue (2026) - Bayelsa Watch. Audi Automotive Statistics By Market, Sales And Revenue (2026) Bayelsa Watch",https://news.google.com/rss/articles/CBMiYkFVX3lxTE9ySlp4Z3FVb3dwMWhGdWZ6LU5GSzRZUTZMTHJ0eFRZeDFETXlGNFY5NnhZdGNHbFZiVmNyMThZZl9uSXhkNVhWZ0dCQ3NhWVB6dVlTZG93bFZpRzl4bmNRUjln?oc=5,"Fri, 10 Apr 2026 07:00:00 GMT",POSITIVE,0.7144,2026/6/22 18:38
bmw_381ccb188ef6ff95,Considering a 2023 X5 M50i (35k miles) – reliability concerns?,Reddit BMW,"Considering a 2023 X5 M50i (35k miles) – reliability concerns?. I’m considering buying a 2023 BMW X5 M50i with around 35,000 miles. The vehicle has a clean CarFax and appears to have been serviced regularly. The asking price is around $57k and I’m also considering a new X5 xDrive40i with the B58. For current or former owners, how has reliability been? Any common issues with the N63 V8, suspension, electronics, or maintenance costs that I should know about before purchasing? Would you choose the M50i or the xDrive40i? &#32; submitted by &#32; /u/m4444_s [link] &#32; [comments]",https://www.reddit.com/r/BMW/comments/1ucnj4d/considering_a_2023_x5_m50i_35k_miles_reliability/,2026-06-22T15:20:49+00:00,NEGATIVE,0.9959,2026/6/22 18:38
bmw_02b3b8f2d5a360d3,My SC E92 M3,Reddit BMW,"My SC E92 M3. Absolutely love this. 2008 E92 M3, ESS Supercharged, DCT. &#32; submitted by &#32; /u/Cute-Victory-5062 [link] &#32; [comments]",https://www.reddit.com/r/BMW/comments/1uc0k7p/my_sc_e92_m3/,2026-06-21T20:37:15+00:00,POSITIVE,0.9997,2026/6/22 18:38
bmw_d35e2b2a59924073,Got my first Bimmer!,Reddit BMW,"Got my first Bimmer!. After many years of wanting a BMW, and initially really wanting a X5 but then finding the 2nd row too small (very little legroom) I ended up in a Audi Q8. The ownership experience of that involved many dealership trips for both minor and major issues. Was finally fed up with it as also the warranty was about to expire. My first and last Audi. So I took the plunge on a lightly used(12k miles) 2025 X7 with the B58. It’s a rare one as it has the Dynamic Handling Package (usually only on the M50/M60) and is otherwise almost fully loaded (only lacking merino leather seats, has Sensafin Coffee, but with kids maybe that’s for the best). It’s an absolute pleasure to drive, even if it’s huge. And more fun than the Audi. It just has an X factor in terms of how it drives. The Audi just didn’t have it. Also the engine is buttery smooth, and very responsive when I need it. And barely any turbo lag. The lag was very pronounced on the Q8 which was sometimes annoying. Anyway, hope to get many years out of this and I’ll baby the hell out of it. And I’m aware of the TC issues and will make it a required maintenance item every 25k miles. &#32; submitted by &#32; /u/bleep6789 [link] &#32; [comments]",https://www.reddit.com/r/BMW/comments/1ubz6s4/got_my_first_bimmer/,2026-06-21T19:40:55+00:00,POSITIVE,0.9736,2026/6/22 18:50
bmw_5b707d516a052780,The New BMW i3 Sedan Gets A Price Tag And A First Edition,BMW Official Pressroom,"The New BMW i3 Sedan Gets A Price Tag And A First Edition. The rumors were true. BMW is moving up the start of pre-sales for the all-new i3 due to strong customer interest. Reinvented as an electric sedan as part of the Neue Klasse wave, the “NA0”... First published by https://www.bmwblog.com",https://www.bmwblog.com/2026/06/18/2026-bmw-i3-price-first-edition/,"Thu, 18 Jun 2026 14:47:09 +0000",POSITIVE,0.9967,2026/6/22 20:45
bmw_1f0bf56f81a51c6c,BMW takes Best SME Company Car Programme - Business Motoring,Google News - BMW Corporate,BMW takes Best SME Company Car Programme - Business Motoring. BMW takes Best SME Company Car Programme Business Motoring,https://news.google.com/rss/articles/CBMifEFVX3lxTE1JeTRKamdNeC11aTBfLS1UYVAxLWtPaUpvNU53NDRrWjJkTW5GNzI3VXM1SnJDVlhnUmZDZ1JLak5xa1FDR285VHRiRUNKZ3NBTDVKYTVHbkpwQ1ZNT2U0cEo0NDU3U0V2bUtFZW42OXlBVE5wR2oyYTVIbnk?oc=5,"Thu, 16 Jan 2014 08:00:00 GMT",POSITIVE,0.9921,2026/6/22 20:45
bmw_8d0cc11501f47634,"BYD Dethrones Tesla: New Global Pure EV Sales Champion Emerges, Auto Market Enters ""Chinese Moment"" - 36 Kr",Automotive News - Competitors,"BYD Dethrones Tesla: New Global Pure EV Sales Champion Emerges, Auto Market Enters ""Chinese Moment"" - 36 Kr. BYD Dethrones Tesla: New Global Pure EV Sales Champion Emerges, Auto Market Enters ""Chinese Moment"" 36 Kr",https://news.google.com/rss/articles/CBMiU0FVX3lxTE1Lcl94MnlZeEhEY0UtSnVQeFdvRnFnNjcwVjEwOWhFUDdQaTRtTWFoWXhJVURxV091M3pPa3lia3NpTHNVdGFFT0kzTHhRS1pQbTJF?oc=5,"Wed, 07 Jan 2026 08:00:00 GMT",NEGATIVE,0.9876,2026/6/22 20:45
bmw_d83362082acfb152,"BMW sales chief outlines strategy on U.S. tariffs, China’s price war, shift to direct sales - Automotive News",Automotive News - Competitors,"BMW sales chief outlines strategy on U.S. tariffs, China’s price war, shift to direct sales - Automotive News. BMW sales chief outlines strategy on U.S. tariffs, China’s price war, shift to direct sales Automotive News",https://news.google.com/rss/articles/CBMigwFBVV95cUxNVE5PS3NHNEgtVmxPUE0wOWxEdGM1OHRLbm9wb004dDhCS3Q4UHpEdTFQVHZocThKMktlS3AzZW1XemZ0eHB6U3pHc3Bya1FGdmZzUGhsMlV3ZjNkdXNZa29BRGdyVGFnRTk3RW9iYUZyY2NJdVZIanZ0b29kZk9lUFdPdw?oc=5,"Mon, 06 Oct 2025 07:00:00 GMT",POSITIVE,0.8519,2026/6/22 20:45
bmw_cbbc2405eff5e9ba,"Mercedes-Benz Bets on India With More LWB Models, Diesel Continuity, and Flexible EV Plans - Autocar Professional",Automotive News - Competitors,"Mercedes-Benz Bets on India With More LWB Models, Diesel Continuity, and Flexible EV Plans - Autocar Professional. Mercedes-Benz Bets on India With More LWB Models, Diesel Continuity, and Flexible EV Plans Autocar Professional",https://news.google.com/rss/articles/CBMixAFBVV95cUxPbUoxcjFlZXlaelpFMU9WVjIyU3hsUXB4dnFfVmYtVUJWSDE5TUVORV9IT1FUY09mLTE0LXd4X2doU2ZmYXI3QXZGY2NUVW5xelc1VlhhT1Y3YU5yY2lGUVJmaGlZNkRzTUNpR3hHNnVLR2dHY2ZVbGQ0NTVmcjYxbFZwcnZLV1Q2U201bHVBdTZKRjE4VElBZlM2VUVtUUxYczV0RXV5bUNjUkNibG9aZDdfbGZlR2xlUGxlWnBEZ2VFcTV50gHMAUFVX3lxTE5KRkp0TXJUTF9XUzNyRVdRRFMzSWNVOFFMdDR2UDFfaFI5N3VOQTZnSW9SVXZiWDFrNWJpTXNzSVdYWW83b0JuRGVPal9rR2UtVjRHN3Z1Y1FZbkFHdTdNZ1ZINDBTbGRxSFUzV25WMF9yTncwbUhVLVZ6RkJ0MXlBNzBYWUs1QUNQbldpUVZSbEU0R0tGNUJxMzB4MHc2U0w3WHZLbEZ5YTdpNnB0M3dYdEJlc1U2TlkxR21DaS1rOFFncmVhSjcyT2NIOA?oc=5,"Tue, 16 Sep 2025 07:00:00 GMT",NEGATIVE,0.9855,2026/6/22 20:45
bmw_0ea10dcba797d25d,Are Insurers Ready for Software‑Defined Vehicle Risk? - S&P Global,Market Intelligence - EV Trends,Are Insurers Ready for Software‑Defined Vehicle Risk? - S&P Global. Are Insurers Ready for Software‑Defined Vehicle Risk? S P Global,https://news.google.com/rss/articles/CBMizAFBVV95cUxQTWhSa2hXTkwtZHhJZ1FWQ0JBQnNLWG01aUNteVMtbjlpVUx1TGVYUWtVV2VnN05laWE1VFJwX1BOVVdOckhJek5JdXMtdkFCbXNaS2hFV0FLSk5BTlI2a2MxN0x3V2M0Qkg3OXJWNGg1dElyZ0hCRGxmXzJwTURGcURoampOazEzaVJhRlFDZnlwTHZxWnlYRnlfMVJJbGVUYkRMQ0hqeFVIbkZ1N01QUG1lekozNEJZYzFIVExOc0xIbVRGNFdwdWV2QlE?oc=5,"Mon, 20 Apr 2026 07:00:00 GMT",NEGATIVE,0.9933,2026/6/22 20:45
bmw_544362c9295c15be,"Long Range Electric Vehicle Market Size, Growth Report 2035 - Market Research Future",Market Intelligence - EV Trends,"Long Range Electric Vehicle Market Size, Growth Report 2035 - Market Research Future. Long Range Electric Vehicle Market Size, Growth Report 2035 Market Research Future",https://news.google.com/rss/articles/CBMijgFBVV95cUxQYlRUdU1vTnVPNXNYb20zaFp0S2FhaUJ6RGxxVzZqMHRkQ3Awa0ZPZEc3NnYzaEcwQ1VtSThkRkpRajJVT3U4UnR6V3hjWEs2TjVJYTliaVpXM2dldm1jcWc5Z01xVjlDTVp1dHU2VDhHVkgySHY0VkdMUHJCNktoR1pESGhoSTB0X3A2dTZn?oc=5,"Mon, 06 Apr 2026 07:00:00 GMT",POSITIVE,0.979,2026/6/22 20:45
bmw_d8abdacf0ae4b6fd,Finally google maps in central screen in carplay,Reddit BMW,Finally google maps in central screen in carplay. I do not know if this post belongs here but today I noticed google maps navigation finally shows in the centra screen instead of full message about „navigation running in carplay” or similar bs. I wish Mapy and others add it too. &#32; submitted by &#32; /u/tdi [link] &#32; [comments],https://www.reddit.com/r/BMW/comments/1ucnoc4/finally_google_maps_in_central_screen_in_carplay/,2026-06-22T15:26:00+00:00,NEGATIVE,0.9973,2026/6/22 20:45
bmw_f142408b7ba6ad76,"4 years and 40k miles later, it still never gets old. I love this car. Happy ///Monday",Reddit BMW,"4 years and 40k miles later, it still never gets old. I love this car. Happy ///Monday. &#32; submitted by &#32; /u/OMGWTHEFBBQ [link] &#32; [comments]",https://www.reddit.com/r/BMW/comments/1ucsp53/4_years_and_40k_miles_later_it_still_never_gets/,2026-06-22T18:28:37+00:00,POSITIVE,0.9994,2026/6/22 20:45
bmw_1f9799b37e04eb55,Have you heard of this bmw?,Reddit BMW,Have you heard of this bmw?. &#32; submitted by &#32; /u/AdIntrepid1807 [link] &#32; [comments],https://www.reddit.com/r/BMW/comments/1ucna4m/have_you_heard_of_this_bmw/,2026-06-22T15:12:09+00:00,NEGATIVE,0.9852,2026/6/22 20:45
bmw_62c968ab2e958292,Had a friend chat my M2 with a drone,Reddit BMW,Had a friend chat my M2 with a drone. Had a good friend chase my M2 with his fpv drone. Was an absolutely perfect day in the German countryside. Why is there a word count minimum? &#32; submitted by &#32; /u/zp003 [link] &#32; [comments],https://www.reddit.com/r/BMW/comments/1ubyyda/had_a_friend_chat_my_m2_with_a_drone/,2026-06-21T19:31:30+00:00,NEGATIVE,0.9521,2026/6/22 20:45
bmw_94d7fa5ff266e963,"1999 M Roadster, 43k miles. Loving this car!",Reddit BMW,"1999 M Roadster, 43k miles. Loving this car!. &#32; submitted by &#32; /u/wbrown999 [link] &#32; [comments]",https://www.reddit.com/r/BMW/comments/1ubw6pm/1999_m_roadster_43k_miles_loving_this_car/,2026-06-21T17:40:50+00:00,POSITIVE,0.9982,2026/6/22 20:45
bmw_b72b2cde7a924313,Key Power Electronics Trends of 2025 and Beyond - IDTechEx,Market Intelligence - EV Trends,Key Power Electronics Trends of 2025 and Beyond - IDTechEx. Key Power Electronics Trends of 2025 and Beyond IDTechEx,https://news.google.com/rss/articles/CBMinwFBVV95cUxNeEJfUjBZYzFQS2tjUzczUVVXc2NGdURnQm9OdmZqZ0RFWWRJSnlyV3lNM0lKWHhXLWxqd0V2dFZsOElISE90d3cyRkxEdUVuNXFWbzFFTEp2TE1hYlJrWktEdFZZUnFHeDBDamhnMUw1MGxnQ3RBcWFoWlREME5qel9VMzRZeG9iaG8yX1pPTzhsT0NWYUhYYnc3X0F2cWM?oc=5,"Tue, 21 Oct 2025 07:00:00 GMT",POSITIVE,0.9938,2026-06-23 00:10:19
bmw_903bd558d5ca90f3,Rethinking oil demand in the electric vehicle era - GIS Reports,Market Intelligence - EV Trends,Rethinking oil demand in the electric vehicle era - GIS Reports. Rethinking oil demand in the electric vehicle era GIS Reports,https://news.google.com/rss/articles/CBMickFVX3lxTE9sZzB5OV9pRS1XMlBUeTRpSFptOGhkam5DR3AtSUQzckczQXB5aXJxMEVuWjdpaHhiUDdFWmIxSGRzRU0tOWpRX19lT1VTdzE2aVBkQ2dDWVdwSk5JcHdNQXFtWFpXVWhqMEgwY2RPaWNUZw?oc=5,"Mon, 18 Aug 2025 07:00:00 GMT",NEGATIVE,0.9881,2026-06-23 00:10:19
bmw_3df60cb5a353ac3c,"G20 2019 bmw 330i with 64K miles for $20,900",Reddit BMW,"G20 2019 bmw 330i with 64K miles for $20,900. Does this seem like a good deal? The only thing is it dosent come with the m sport package or the digital screen. So if I do get this I would have to manually add it myself. &#32; submitted by &#32; /u/Rjkim353 [link] &#32; [comments]",https://www.reddit.com/r/BMW/comments/1ucvz8t/g20_2019_bmw_330i_with_64k_miles_for_20900/,2026-06-22T20:27:47+00:00,NEGATIVE,0.9988,2026-06-23 00:10:19
bmw_ad656ad714a38144,Check Your Hoses and Couplers,Reddit BMW,Check Your Hoses and Couplers. Little PSA for my big intercooler family. Your charge pipe coupler has probably started to shift. Add this to your list of regular maintenance and checks. Ended up shifting toward the Serpentine Belt and got a NICE slit down the middle. I was getting little to no boost and no turbo noises. BUT no CEL. Thought it was my Diverter valve or a blown Spooly Snail. Decided to buy a smoke test kit and so happy I did. Pleased to find out it was something super small. Ended up getting some metal zip ties and tying it back a bit on the new coupler. Boost restored. Money saved. &#32; submitted by &#32; /u/Particular_Airport80 [link] &#32; [comments],https://www.reddit.com/r/BMW/comments/1ucp5mg/check_your_hoses_and_couplers/,2026-06-22T16:19:38+00:00,NEGATIVE,0.9809,2026-06-23 00:10:19
bmw_ae03537e9eae978d,"BMW SLP to Launch EV, Battery Production in 2027 - Mexico Business News",Google News - BMW Corporate,"BMW SLP to Launch EV, Battery Production in 2027 - Mexico Business News. BMW SLP to Launch EV, Battery Production in 2027 Mexico Business News",https://news.google.com/rss/articles/CBMijgFBVV95cUxOMGpvMjUybDEtZFI2WXdfdjJJdkhYX2ctcGJVd0VwVW5tdEJ2cmhoVWlDYVl3TnkxSVQweVVwX1V2ek9mTFFXNzVwNExHaTR4RFltN1lFeHBsU0JIZVZpY3lwRDdGTFlzWkUzR3R6b0FwakNnSXV2THQ1dHJDZWhIeVhVVVR6WlJPaVQ0MUFB?oc=5,"Fri, 19 Jun 2026 09:50:10 GMT",POSITIVE,0.985,2026-06-23 00:14:45
bmw_b3fd3547b64c98cf,"German robotics, automation company picks Greenville for headquarters - Greenville Online",Google News - BMW Corporate,"German robotics, automation company picks Greenville for headquarters - Greenville Online. German robotics, automation company picks Greenville for headquarters Greenville Online",https://news.google.com/rss/articles/CBMi1AFBVV95cUxPWnhiWS1tMXR0MnU5aDR2cTVVWnpkWFBTVjBpM2ZyUm9qM2Q4bWhrU1huN2FDX2M1c3B6bllzeVAxZUc1RFJ1UDFLSGQ4MGRUOW5VRlVfR0JBQU5kRGN3NXoyVnFiZk1FV3lxM3h3bk9WdnJrN0FWNU5GTl9JVXpMN3BoUGVhR3F2UGc4MEx5U2xOR1lZdHlfSlhNaGgtYzdxMkczaEN1RTFQOHItaHc5NDEwblZVdjJaS01jVFFPekJ0Z2FGZVhlT1BnX3d3WFMzVVFEVg?oc=5,"Thu, 23 Apr 2026 07:00:00 GMT",NEGATIVE,0.985,2026-06-23 00:14:45
bmw_8d60a8239e43e1b8,"BMW Strengthens Mexico Strategy With Sustainability, Labor Deal - Mexico Business News",Google News - BMW Corporate,"BMW Strengthens Mexico Strategy With Sustainability, Labor Deal - Mexico Business News. BMW Strengthens Mexico Strategy With Sustainability, Labor Deal Mexico Business News",https://news.google.com/rss/articles/CBMisAFBVV95cUxPeFBWSmtBajE0SXppWERYNG9hNmdxdlU2V2Z1WW4xQk85NVBreTgyM216YUluRnFzbS02UkNsMk1JQVNERVpSZ19adE13N1UxcnhiaFNlcnhlVkdXZWlUOVF4ajFhOERfcURITXgtUWsyWjJrV1Vld3FLTzFBMElabXpXczdfWGN3LXdsN1J3NEh1MldvMnNwUjFLSWxnTXZLYWZ3bHFRTGtGOWNUczgyeA?oc=5,"Mon, 13 Apr 2026 07:00:00 GMT",POSITIVE,0.9993,2026-06-23 00:14:45
bmw_57a70ea48f4f6ff5,BMW overtakes Mercedes in Q1 as luxury car market shows flat growth - Business Standard,Google News - BMW Corporate,BMW overtakes Mercedes in Q1 as luxury car market shows flat growth - Business Standard. BMW overtakes Mercedes in Q1 as luxury car market shows flat growth Business Standard,https://news.google.com/rss/articles/CBMi0gFBVV95cUxORlVOR1BQRGIzdXNQNlZXVlhzLS1UVElKamszekNEY3lOQ0FuTG9sNnRuYXlpbVBiNlpfZmMzMTRqQTdXOHJyQ0NjejVsaGFhRFNBX05VMEVROGs0U09CV1YzOVBrcE5HczZiLUdjTy1BeHhrbW1vVG9zZU9CNmY3eDZ3UlBMUEVzYjUwNXM2UnNLTmVwTXp0RzRHVjdNYTdlMVlOLXJEdzhkZC1DZ3VpajRQTWxHT1VYNWVxSzNTbGdGZXZ3aE9XRGRhTXN1Y21BQVHSAdcBQVVfeXFMUHNpSGExekFOYnFRaDRVTkFTOFRFVFMxMEUzUnh6YUtfY3JLcTBnMkNXT0ZDOV9mLVJBaWp0amdzRG5Rc3pmanRMOXhOOGlTMlNaUlp2aTBzX3JnXzZXZld3Tnl6eDh1LVBMVnlhNXpEZzhNYkIzR09YS2FQekdCNlppbjlheFZmQ3ZMV0RTZGlleFhiXzljOXJ1WjlxUkpVSEJOMUsyTUx1b0ktekFiQ0l4QnE0aHRIcFBRNnQtMGdDQUxKeExTcWFROVppWmFtSlBzNjBCalU?oc=5,"Mon, 06 Apr 2026 07:00:00 GMT",NEGATIVE,0.9949,2026-06-23 00:14:45
bmw_ba1972746bc5b9dd,"India-EU FTA duty cuts could boost luxury car market, says BMW India - Business Standard",Google News - BMW Corporate,"India-EU FTA duty cuts could boost luxury car market, says BMW India - Business Standard. India-EU FTA duty cuts could boost luxury car market, says BMW India Business Standard",https://news.google.com/rss/articles/CBMi0gFBVV95cUxQQXJPdlVKN0ctLWtoSEtEWkNzTHF1UlpXWGRUODE0T1lKelJOVzhPU0ZmdGl0bmZIMElTRVRvTDVxNUVuTVo4QWZMWnpxcDNSN0NrcXhEaURLNDhqTUxRbnpCMkJnNHRtT2p4eVBJbTJ6WDdTTFZjMU15RzlXWHpEM0g5MmxmVDM3SDdWUlBOZ1BlVFNkdjhEVHhtRWdpeFlFdkwtUkVkT3BNX0tSVmVJSzhFRzN5aDFXaTdpX2pZMVhVMEN6S2V0VFEzcnQ2QWk1RlHSAdcBQVVfeXFMUE0wNzNJMWh2eE5XVXZIUlltcW5xQzJfY0kyZ3RMSGpaVml2WUxXZjUwZ1RrdHJCSE8tNEVXdG80RXN5TWVZQS0zZHotWnhEWU9ET29sakFjbjhLT2FWNzVQcF9LdndlRXJDZU9zckNFVmdyTjRodXNRdnNXbDA5TmVRZDhJWHFXSFRldlRNYUVRT2k1bHRsandweFJCbUlmYWJDa3ZoY3JGSzhJM1duMFpmLWJLdTJiUEF3RWxaRDhkYUVhV3k1UjVqamtwRDltVjR4YlpqQjQ?oc=5,"Mon, 26 Jan 2026 08:00:00 GMT",NEGATIVE,0.9814,2026-06-23 00:14:45
bmw_a775847d208b91c9,"BMW urges faster, clearer rollout of FTA duty cuts for car imports - Business Standard",Google News - BMW Corporate,"BMW urges faster, clearer rollout of FTA duty cuts for car imports - Business Standard. BMW urges faster, clearer rollout of FTA duty cuts for car imports Business Standard",https://news.google.com/rss/articles/CBMi0gFBVV95cUxNRm1XT3JONkxaZTVPRmljNXlDSVhYUGdQU2FoVDJUcUdEQTM0X2ctRk9KaFdEMlRLRHlnUG95ZWRIVzlfM0NYU2ZGRVQxQk1EVjBYOUg2Y0RWY2RyWkV2aXkxVnlCdTNUVnVKYjRhVnZvdEJZY3FiYi1wcFJsZGNSNk9ZTXlQSXdSR0ZlRGVHY056dzE5cmVVaU9ncnVzdmczcEFzc3RQXzZDQURvclcxNzNHX2U3RkpRTU92aF9IYjlDZUp2TGEwaV9YWHJuVEI5VUHSAdcBQVVfeXFMTWpTcDFGYzU4TFJhWXNhdTYyejN4QTA0a0VyVUhNMFpUeWtYVjVUTTh5c251aDQ4cDNIdU8yR0hEbnUwVm9DaXFrRTJVRERQVlRjWUlrQWgtYlF0VF9seDRCMXI0blVEWjZEUWdjT3NYNXpRaDBQZlZCQy10WXBkcGUzY2YxUFlwU05XV0ZYT25NbkNkT2FSbDFUUkVsbFhmTFZucC00aVpVQUNkbndkQXJnbzJCTW9JX2tMYkRoZFRCX25oTWJKZkhZTU54ZEI2MzRHNDI0clU?oc=5,"Fri, 10 Oct 2025 07:00:00 GMT",NEGATIVE,0.9137,2026-06-23 00:14:45
bmw_1ff28fae34bde264,"Ford, BMW, Toyota: Leaders Set out Q1 Financial Performance - Business Chief",Google News - BMW Corporate,"Ford, BMW, Toyota: Leaders Set out Q1 Financial Performance - Business Chief. Ford, BMW, Toyota: Leaders Set out Q1 Financial Performance Business Chief",https://news.google.com/rss/articles/CBMigAFBVV95cUxPRDRzNnBIZW84RURaZ203b2ZaY2dyNDZoclJMeVpIME1ORDRBVmZHRHlOekxaazJndmhYM3NPTlJOZzFXS0NCSjVZWGRDLUJoanhyQWlBSlNfSlRVRjFUNlZaQXozSWs0TzhKbllqVkE3TEgxN21hZDJ5MzRicDd5WA?oc=5,"Tue, 12 May 2026 10:49:29 GMT",POSITIVE,0.9766,2026-06-23 00:14:45
bmw_9f37823c554af49c,Dealer news: CAR Group cowboys up; acquisition in Indiana; new look for Canadian BMW/MINI store - Auto Remarketing,Google News - BMW Corporate,Dealer news: CAR Group cowboys up; acquisition in Indiana; new look for Canadian BMW/MINI store - Auto Remarketing. Dealer news: CAR Group cowboys up; acquisition in Indiana; new look for Canadian BMW/MINI store Auto Remarketing,https://news.google.com/rss/articles/CBMi0AFBVV95cUxQajRDY0w1andscV83UTNQanh4OTBZWmF2VFR5ZkFpaDR5ZjRVWGx0X1ZlTERDQ2MzM0VBOW9WcDNiVkVXY2JvaWRaT2ZyU1BWM2tfWEJBWWRpYjdTUzhlSEFiSnZpVWVNNzNaRmVNbVVWb3NuVnVXUkRBbXZ0Z1g2M2U3U0xMXzc3NWkwcklnSU9ocVhyNWZSTWNYYzh2bjkzRnZEbTdCWlpiNk90eEw4Y3Z0Uk4xd1ZhQk4wS1hjYnJ6VU94bVdMb196TGNGYlVq?oc=5,"Tue, 22 Oct 2024 07:00:00 GMT",NEGATIVE,0.98,2026-06-23 00:14:45
bmw_99f4d2858c78e200,BMW and PreZero partner to drive closed-loop vehicle recycling - Recycling International,Google News - BMW Corporate,BMW and PreZero partner to drive closed-loop vehicle recycling - Recycling International. BMW and PreZero partner to drive closed-loop vehicle recycling Recycling International,https://news.google.com/rss/articles/CBMixgFBVV95cUxPUEVRTE9aU0h4WkZ5NFpqS2lESGladHZkZVFrVkl3VDk5Y0o1VktMMGZPLVo0ZVgxb0tlWmFWd3lycU9kLVFvUjV1TnhfdmFIVmQ3QzdYWmcyelVwaTItaGZaOHlPLUxtWHp4MEdydjVjeEdMdlRfRlNUQmd3ZGhFZTgtZ3lwOXdudThKZ2ljVGtrVDd2NF8xem1KZ3U3RHR2UWJWcU9zZ0Y4eXZvS0djTFNWX2tVRmRUeC1LMmQ1WFpTOEZ2Z1E?oc=5,"Wed, 11 Feb 2026 08:00:00 GMT",POSITIVE,0.7159,2026-06-23 00:14:45
bmw_69e1ae454d02b9bd,"25 years ago, BMW opened shop in South Carolina. The economy shifted into overdrive - ABC News - Breaking News, Latest News and Videos",Google News - BMW Corporate,"25 years ago, BMW opened shop in South Carolina. The economy shifted into overdrive - ABC News - Breaking News, Latest News and Videos. 25 years ago, BMW opened shop in South Carolina. The economy shifted into overdrive ABC News - Breaking News, Latest News and Videos",https://news.google.com/rss/articles/CBMilAFBVV95cUxPLXFIZWRYdkQtS0w0UG80VWFydkNYdnRKQ05GemlQb241dl9yUmFZMXkxSVoyc1YtUjVhaXhCV2RlWklSQzhkdThWOWFmYTNsWW41UFZzb1pmamJfMkNsU1lkT29wMHB0QjNndk5yZmQyN3lIaHZKbXVuYlY4MUZERmZGaFZFVHJPcDdPQll5dHRzVTB10gGaAUFVX3lxTE9hdHZnRzMyVjkwTVNpNXQxVG9jeXFET25Lbmoxbk11MTBHSUtxWmtMM1BsRkxlNWNHWUpCdTBtd2xxRmhGcFM1VUN6UEx1X2tzZDB5UkFQdFdqbUM0eVhXU3lXOE5nLUkxTnNacTM4YkNvOFRnVWdDa0pkenZHT3IzQkowd2Y3NFZsYk95OVV3UjhLYWI2YUo2anc?oc=5,"Fri, 13 Dec 2019 08:00:00 GMT",NEGATIVE,0.9817,2026-06-23 00:14:45
bmw_7d2215c298a24b89,Sirius and BMW Rebrand Planned Hydrogen-electric Business Aircraft - Aviation International News,Google News - BMW Corporate,Sirius and BMW Rebrand Planned Hydrogen-electric Business Aircraft - Aviation International News. Sirius and BMW Rebrand Planned Hydrogen-electric Business Aircraft Aviation International News,https://news.google.com/rss/articles/CBMiuwFBVV95cUxPekFiejZKeTJ0Rk51QmZ1RFRyZHI1U0U2R3NCcVBLTGVyVFg4a0h2T0VDd3lQR3VTUUlJSk11QzRwcmJxbElHWlMybGdxYVZoSW9jUGFGYVhKM1pEV01xOElPNTROd2xWTkJocXVEYm12bVNYeW94QkZtYnFGci1NZFZYcWZLTFVaVWdpUlNkUlJOS2NCbkZLR0RWTHFNdXBIZHNtM1VjUzBZb1d0LTZudy13c1VzYlgxelA4?oc=5,"Tue, 25 Jun 2024 07:00:00 GMT",NEGATIVE,0.9979,2026-06-23 00:14:45
bmw_086e76753c8c5e98,BMW invests ₹803 cr to boost high-end steel product offerings: MD - Business Standard,Google News - BMW Corporate,BMW invests ₹803 cr to boost high-end steel product offerings: MD - Business Standard. BMW invests ₹803 cr to boost high-end steel product offerings: MD Business Standard,https://news.google.com/rss/articles/CBMizAFBVV95cUxPemg3b18xQ2xmSzN3S1FOd19WSXU2VmhadzIzUTVFRkg5Z1hQeklDd191ZVpEUnhHOV9Xby01WHVwQ05pd3RQQ3JRVHV0bkVKOUZBdTlhaGZwNnp1N1V6SEViTDZsMlVadXdDZE00OEZhSHZkbndobkF6NTU0XzYwa2pPOERjSko1TU9MQnV6d054NVZjVFVKSDZ1V0VNWTN2R0hwcmRjUDRMV0JrenlGSEF6RUU1eV9xZEp1YVUyTmNEU2JuNFp5SU9QVmjSAdIBQVVfeXFMTXZtOWtkYXhLQzJBSzlMRVpWVi1CV1d0NW41YWFBWmJRM0lYNzZ0bmRvYmFzdEFtLVE2WjJSSHhQOWZEU2JiQk9Cb1N6aFhOaF93eFFvc1ZmOFlaSDNGazZyYVdtTTBPOWJyc1NhNHBpeEhkcVFMcXVkVjdVbXpRUTRoNWNFaXhaWHpCVlZxQ0wxWWdFUThvZ3libnpRcUlZbGVTQWRmWHhQZ2l3c2Fmc0k5ZUNjNWZaaU1XTlBtZVh5aVhiaWEzajlCdENPR1JQSk5R?oc=5,"Sun, 24 Aug 2025 07:00:00 GMT",POSITIVE,0.985,2026-06-23 00:14:45
bmw_f7c9040c7ae43ca4,Hardeep Singh Brar appointed as President and Chief Executive Officer of BMW Group India - Business Standard,Google News - BMW Corporate,Hardeep Singh Brar appointed as President and Chief Executive Officer of BMW Group India - Business Standard. Hardeep Singh Brar appointed as President and Chief Executive Officer of BMW Group India Business Standard,https://news.google.com/rss/articles/CBMi_gFBVV95cUxPdEh1WE50Y1huTHlXbHNnM0NJY2ZUODhjdkM5TGlJSkFSVmNqMVZmUFFZZXRDREZRNDFydG1HS3VpSnlleFpzWWQ5ajJUdW10WDNfeGZza3dQckVFWDFRVjdfeDlGQXBVMF9EOW1wck4tYzI2VGlOUHdZWWJ4NlJ1ckRaOXlKbk5NV29GcnpXTGNtSDZBeE1NTkdJa3d5UFAzbnJoY2ZFNV93QnZvTWZiNXpRZWpFSEh3dERBanc1WEVHVl9teXBMbkN1N1d6T2RwU01EQ18yWWNVY2JRWHY5dEQzT0hSYUpzR01LY0pwXzJ1OUZ5U1FSNnhSbkxPZ9IBgwJBVV95cUxNVFFJUzBkTVJ2dW1Ydmk4bUJVUTBDekZkRkxGc3JCUjZjejk1bTNQR2kzWFppblBEUjJOQjY5bU9hb3h3MS1VbWhfUGp6X3dnaG1sZGxCS0JWMHNHMDFyQUZjak5RTmhNZ0psdFg4M2Z5SS1qRmlfY0ZsVk02X0FMV3pkWnJDWER4eWZfWjZlZEpmUVViNGE2dld6eHQwb3RMeHUtZERBZVpkN3phOHIzXzloaHJkWHdEWllBdjB0LU9McXVRRGJieXZMX1BqWFVFY3JoOVVTY21XZXhJYVRYWDBJdG0wZTZROFVRVVl4NmJjazdMcjVvRklISzMzZE5PSlVN?oc=5,"Tue, 08 Jul 2025 07:00:00 GMT",POSITIVE,0.9883,2026-06-23 00:14:45
bmw_b0fef982a8dfb333,"BMW Hawaii: 'What can we do, today, that will sustain tomorrow?' - The Business Journals",Google News - BMW Corporate,"BMW Hawaii: 'What can we do, today, that will sustain tomorrow?' - The Business Journals. BMW Hawaii: 'What can we do, today, that will sustain tomorrow?' The Business Journals",https://news.google.com/rss/articles/CBMiogFBVV95cUxPVXAwVzE4X3IyVnBVZ1F0NFA2bDBHc1JvSmV2MEZGS2JEWlN4elRralNzbXQzc0tJdlp3bklEVnluTlNUMloxSmdYNHY1TmNiOVpFX2dwb0Jwd2drV09aaklvV3ZXRU9zcV9paTBDNmh5UjNXREtzbEo4cVFWYm5UXzFPNngwVm9ZZm93dHN2c3NzdEJHMUI0OFpUY0JQeHBRZ3c?oc=5,"Wed, 20 Sep 2023 07:00:00 GMT",NEGATIVE,0.5606,2026-06-23 00:14:45
bmw_e1caad8e0ea704f3,BMW headquarters searched by police in emissions raid - BBC,Google News - BMW Corporate,BMW headquarters searched by police in emissions raid - BBC. BMW headquarters searched by police in emissions raid BBC,https://news.google.com/rss/articles/CBMiVEFVX3lxTE5iLUNjb0Y3RndhWkdGUndsN2hPdUVWM0llMjUtbFpzNE14Vkl6dnlLTDdwRE02QTlLeXhqLVhNTGpUVmY2TWxzd0l3WHhEYUdoQzRRMA?oc=5,"Tue, 20 Mar 2018 07:00:00 GMT",NEGATIVE,0.9964,2026-06-23 00:14:45
bmw_8f60f6795af55268,"BMW India posts highest ever sales at 7,098 units during first half of 2024 - Business Standard",Google News - BMW Corporate,"BMW India posts highest ever sales at 7,098 units during first half of 2024 - Business Standard. BMW India posts highest ever sales at 7,098 units during first half of 2024 Business Standard",https://news.google.com/rss/articles/CBMi3AFBVV95cUxPVkRHRWdoZ0ZVT2p0QkFqWmNDSEU4RHVBTWt5VWFkZUVLWVNHRW1SUTV0R1JnLWtEVENIUFgzNWxRSVlnY09ZYlY4UzZMLXdwNW40WE0zdGVsOW9ENEltRUtUdlVUSHB4dHBzS3d2ZTlFd1dPbXZwZFItRl9tWVQ0TnhrcVZiaDB3OVVkMkxCRkFNMGZqUnVDdUhPaHg5bGlNdUZjRWNMZ0U2NGpZMEJneUhDT2ZzRklEd0Zqd3JpOGlaNjhlSjNEWDFoQ3VnZllyMk8yT3E4TWU0N1Zx0gHiAUFVX3lxTFB1bXJRLU5nT2ZnUFZtb0ttVzlQbVZkS2hJcDk1SkdrTGZ0X1M5NmFOSGp0aGNfREhPdk5nT0dkQ1k5UEgtbjRKNW83RFBVd0VKbjRsN1Fnb1BrTFYwWC1DVEdOdWpyc1dBbFluVXE3NkVwSFZURG9XZFVlR2NTNlkyaXRfUV96UzFwSUJqRTdDMWxoV3RsLWkwU0FOOXNUMDhwbExVaUNsQ1BUY1AzeENOaFZWOURhTEZRZkV3V0lvMFp3bEpRS2s0LWtBU0dEeUNIVy1MRjJFSTE1N2VqOS1lTlE?oc=5,"Tue, 02 Jul 2024 07:00:00 GMT",POSITIVE,0.9708,2026-06-23 00:14:45
