id,title,source,content,link,published_date,sentiment_label,sentiment_score,pipeline_run_time
bmw_e6b2958566f7a96d,The EV lease returns are coming: How off-lease EVs will impact supply and demand - S&P Global,Market Intelligence - EV Trends,The EV lease returns are coming: How off-lease EVs will impact supply and demand - S&P Global. The EV lease returns are coming: How off-lease EVs will impact supply and demand S P Global,https://news.google.com/rss/articles/CBMijgFBVV95cUxNemRxMm40RU45U0ZyRVI3QzFPQWMxWmI3V1B2UWVzMGRMYWM4SW9tWGxxUzRtaTgyYk1NSUJrWmRDdE5TRkszU1RSTV9uc1dDNmNpYXpnQW1CZUE4R0ZCVUQ0YVgzTTRDb1VQa0NZc0ZXLTN3MTJVWWpMVGN3RjhqY1hVaFFoSHlwdW5TcjBn?oc=5,"Mon, 30 Mar 2026 07:00:00 GMT",POSITIVE,0.8215,2026-06-23 01:12:01
bmw_49ba5c96ce54896b,Oil supply disruptions and USMCA deadline impact auto industry stability - S&P Global,Market Intelligence - EV Trends,Oil supply disruptions and USMCA deadline impact auto industry stability - S&P Global. Oil supply disruptions and USMCA deadline impact auto industry stability S P Global,https://news.google.com/rss/articles/CBMivgFBVV95cUxPR3U0cEVJRTNMS2RsRTJHZFVzclFtVTVZV281SVNaUHJzUHZBX1NKQldDc1k0cFlOT2pmaFkzc2VOR1EtTlFQVXNvendJUlYxTTBOd1RuQTVaWG9KS2tQVXphekY4eW9oUFpEMEJueWUzZHRkeUFYakV0bzBXanR5N1lBM0dwUV8zdk1IVEc1TTd4eVlzS0ZYS3I3cjNmMEsyaHhzVUxoS2dNY01NbzM0ZXNNdEg0Q1hzWnhrdUtB?oc=5,"Tue, 05 May 2026 07:00:00 GMT",NEGATIVE,0.9947,2026-06-23 01:12:01
bmw_2358ce1884bbfe01,"Electric Vehicle Adhesives Market Size, Share | Growth [2034] - Fortune Business Insights",Market Intelligence - EV Trends,"Electric Vehicle Adhesives Market Size, Share | Growth [2034] - Fortune Business Insights. Electric Vehicle Adhesives Market Size, Share | Growth [2034] Fortune Business Insights",https://news.google.com/rss/articles/CBMihwFBVV95cUxQQnlZVkVnaDVrMXBxMGJESGNnQnJ3NmV0VUhWMHZaSTZKdVRndW5LbXRld0VqNWtVdDlMcVpPX0ROUVJ3WExGUkNDVlQyUS01Qm5idzN4MHdRMW1mcWJhS19jRzItYVBOZG9SVXl2Z2VtUktaTDFzRXNzWmNNem1FWDdxRlg2eTA?oc=5,"Mon, 01 Jun 2026 07:00:00 GMT",POSITIVE,0.9983,2026-06-23 01:12:01
bmw_d83d9eae91cc869a,Battery Recycling Supply Chain Analysis - National Laboratory of the Rockies (NLR) (.gov),Market Intelligence - EV Trends,Battery Recycling Supply Chain Analysis - National Laboratory of the Rockies (NLR) (.gov). Battery Recycling Supply Chain Analysis National Laboratory of the Rockies (NLR) (.gov),https://news.google.com/rss/articles/CBMif0FVX3lxTE9WOGdja2NoWEtYMkN0Nk5XT2M1akpMS0VZVGdjZlJEeEpzQ25yTkxfcks5bWJSWFhiTzdfQ3lhSGptTE5nY0tic0hxdjBxcUp6cjZuUG5SMXVTSTI4MjNCbnBmYkVOQzBNWXNlR0hSSVNMakUybzU2ZkUtYWRRSms?oc=5,"Thu, 05 Mar 2026 08:00:00 GMT",NEGATIVE,0.9926,2026-06-23 01:12:01
bmw_f01726c3d34d5025,"Europe Passenger Electric Vehicle Market Size & Forecast, 2035 - Global Market Insights Inc.",Market Intelligence - EV Trends,"Europe Passenger Electric Vehicle Market Size & Forecast, 2035 - Global Market Insights Inc.. Europe Passenger Electric Vehicle Market Size & Forecast, 2035 Global Market Insights Inc.",https://news.google.com/rss/articles/CBMijgFBVV95cUxQOUxFd29XNkFWSEg1Y1VjZzJPQ1Z4MHNFeExYMklZX3BwUUhNMmtDMV91LXhPWWF4ZDZFeUhZcE1HQ0c3d1dQY3ZsRWp2eXBDWjZHQzJFS2FvVkRGTFJSMDc5azZ4S2J5WHk5bDZ6SDlZZ2Q3UWZGR3JzVlBCVGdTUUVzTlhkQXBzTnI1ZjBn?oc=5,"Thu, 12 Mar 2026 05:45:48 GMT",POSITIVE,0.9902,2026-06-23 01:12:01
bmw_ceed4ea0ccb0f0e1,The push to eliminate rare earth elements from EV motor supply chains - S&P Global,Market Intelligence - EV Trends,The push to eliminate rare earth elements from EV motor supply chains - S&P Global. The push to eliminate rare earth elements from EV motor supply chains S P Global,https://news.google.com/rss/articles/CBMivAFBVV95cUxOYjY0VjdVMGpneTBxOXNrMU0zRTJwM1RUQTVnT2RrUW9xSzB2MmlmaWZwb2Vxc3Z1WTZMZ0dVb3JHR0xJVGZEaHAtRThzbVlteFN1RzFVV0w2VmVjZGFRUEk5Sk93QTAyZzZCRFBFaHFVTncxeUZNWXlWcDdNaW1qbmEzRjR5Nk5kYUUycXZENWs3aWlhVDB2cFJwd3dGUXYxUHlNUGRCVXIyNUNsMDJZTFluajlXcUZEeHcyag?oc=5,"Thu, 27 Nov 2025 08:00:00 GMT",NEGATIVE,0.98,2026-06-23 01:12:01
bmw_2c747e4b889cbc63,"Specialty Vehicle Market Size, Share | Industry Report [2034] - Fortune Business Insights",Market Intelligence - EV Trends,"Specialty Vehicle Market Size, Share | Industry Report [2034] - Fortune Business Insights. Specialty Vehicle Market Size, Share | Industry Report [2034] Fortune Business Insights",https://news.google.com/rss/articles/CBMie0FVX3lxTFBUQUt4X3VtcGJyeEFIcmpzMXgwZU5PNG5GdGlHQ1lWM3M2bFZjVlBQdjhrYW9oaV9iOWhXa1NQRWtGX3VwenppaDQ4YVEzYkJvUnVVeXVUUkpQZ1ROSHc2ZE5aMzktVU51VURjMENzX2lLMTVrNXhCOTVCMA?oc=5,"Mon, 01 Jun 2026 07:00:00 GMT",POSITIVE,0.9898,2026-06-23 01:12:01
bmw_29391ff0de58b8fe,Canadian electric vehicle industry insights: Q3 2025 - S&P Global,Market Intelligence - EV Trends,Canadian electric vehicle industry insights: Q3 2025 - S&P Global. Canadian electric vehicle industry insights: Q3 2025 S P Global,https://news.google.com/rss/articles/CBMipgFBVV95cUxOZUlScmFadUVLaS1QUVdBcHVFR1M5RkMzZm5jZnVoSDAwemh6NkY3ZW5fVm5DTi1ZVUU4UkJWY2cxRGxldGVlT0xKMjl6aC1aX0w4Vmxra2Fmb0lGclY4bXZXa3ItMnd0V0prLV9KbVZQdzlUNE55dHVEQ2VxWVo4dkY4QmJhN0JIeVBGc19seUY4TG8zRmpXNEpnR3E3QWhKMmwzOEFn?oc=5,"Fri, 19 Dec 2025 08:00:00 GMT",POSITIVE,0.992,2026-06-23 01:12:01
bmw_9b029864b407d762,EV adoption rates: How the US and other markets compare in 2025 - S&P Global,Market Intelligence - EV Trends,EV adoption rates: How the US and other markets compare in 2025 - S&P Global. EV adoption rates: How the US and other markets compare in 2025 S P Global,https://news.google.com/rss/articles/CBMiuAFBVV95cUxONGI3V3RWWkQtOVhRZ0NNUXF2NWJfblNYbW9tX2NOY1hsSHhHTktUT0NyV3FqVVFMUVRrVFZGWmwzU2g5RFZXVkRNWWp1MjIwc2lxamtvamtGWFE3My05X0ZaV3dicGRhTWFaWW1Ha1NhRFVSa0hwZ3I5MGFUQm5TdVNUNEt1T2Vra3Zld0JCOUY4eXlEdnA4Z0Q1elNnS3N0OUpEQ3VwSF9RNUVMMTY2ZWdRS0JHb0hT?oc=5,"Tue, 14 Oct 2025 07:00:00 GMT",NEGATIVE,0.8861,2026-06-23 01:12:01
bmw_53957ed5504a4021,Porsche at a crossroads as electrification tests its DNA - S&P Global,Market Intelligence - EV Trends,Porsche at a crossroads as electrification tests its DNA - S&P Global. Porsche at a crossroads as electrification tests its DNA S P Global,https://news.google.com/rss/articles/CBMiqwFBVV95cUxPV1dERU1teTZvYmxDVks1TDFXREZSQm1TaEVmZElaQzczbEN1cVhxbU5vbzEya0hxOU81cDFxVUlIYVQwUmZxS2p2MmlhTGFhdmpBaFdsOXBVQ0dqcmRmNy1Wd21HdG1uTGNZeWdQMWwzSm9GaFR0WWhEbVMwOE1EaV9mZWxmd3JOSGdCbXI1aEdFa1NhWDBjNHhPMi1NS0k5c0RBVGU3MEpFR3M?oc=5,"Thu, 16 Apr 2026 07:00:00 GMT",NEGATIVE,0.9464,2026-06-23 01:12:01
bmw_8827c6b16e7785a9,"EV Platform Market Size, Share, Trends | Growth Report [2034] - Fortune Business Insights",Market Intelligence - EV Trends,"EV Platform Market Size, Share, Trends | Growth Report [2034] - Fortune Business Insights. EV Platform Market Size, Share, Trends | Growth Report [2034] Fortune Business Insights",https://news.google.com/rss/articles/CBMic0FVX3lxTFBYWWo2ZGl4Nk5WWlNfU3JWNG5FUVZ3ZlJIc2pfaFJvbXNLclhWNk10Tzc0MHJqZkhqUEZiMXAydFNqVkE1cktXRkQyZjFEaXZBb1BndkJGWUNiTkhkc2hFYnFzUW9vdmQ1Rjc3aU9lVWRVVDQ?oc=5,"Mon, 01 Jun 2026 07:00:00 GMT",POSITIVE,0.9942,2026-06-23 01:12:01
bmw_4be318de83c5e3d9,Commercial vehicle market outlook: 2026 growth trends - S&P Global,Market Intelligence - EV Trends,Commercial vehicle market outlook: 2026 growth trends - S&P Global. Commercial vehicle market outlook: 2026 growth trends S P Global,https://news.google.com/rss/articles/CBMiswFBVV95cUxPdndCeHVDdXFyb3B5dFJsYU1sc19ncnZCcG5HWmVHRWV5TjhTVDVHbW5uR1Q1MTlTakVsVTdCSFdHV191N0hYVWk3ZHhrLW1yQlgzZDlUX0c4b0pSdjNsZUw1ZjNYQUVobVJHd1BKdjdsck0xV3FjRmZtaUxjZG9nX0V6SEVYM1FnM0lCRnRIT0tTeUpWQzlpX1dYVnR5ZWhVRS11a2RMZ0l6N0xiMF9tZFllSQ?oc=5,"Mon, 09 Feb 2026 08:00:00 GMT",POSITIVE,0.9966,2026-06-23 01:12:01
bmw_2e3bcf9fb7829351,Manufacturing and trade – Global EV Outlook 2026 – Analysis - IEA – International Energy Agency,Market Intelligence - EV Trends,Manufacturing and trade – Global EV Outlook 2026 – Analysis - IEA – International Energy Agency. Manufacturing and trade – Global EV Outlook 2026 – Analysis IEA – International Energy Agency,https://news.google.com/rss/articles/CBMif0FVX3lxTFBBdlRidlFWTllkZFUwX0tURmp4UmxwenFiRk5tT29WQndpN0xVbU55TV9VRGFJaFBGMm1weTZyczc5MjJ5aDZDVlhqSnh6Mk5EMV84UE0wWk1JWXFjWGpfY0EwN2JXcjZuckx0dVJ1LWFFTjU5bnpSc1lPek1SMWc?oc=5,"Wed, 20 May 2026 08:51:37 GMT",POSITIVE,0.8685,2026-06-23 01:12:01
bmw_61def7415e0a57d2,"Global EV sales reach 20.7 million units in 2025, growing by 20% - Benchmark Mineral Intelligence",Market Intelligence - EV Trends,"Global EV sales reach 20.7 million units in 2025, growing by 20% - Benchmark Mineral Intelligence. Global EV sales reach 20.7 million units in 2025, growing by 20% Benchmark Mineral Intelligence",https://news.google.com/rss/articles/CBMiqwFBVV95cUxQSkZvRjkzS1FlZGE2cS1jSUNINEIyMThZSmhOQld3NmZVUW1LQ2xTbUtaOGVkYUpGMlRQeUVYSEk5MUxHMVF4UFVzemtWclltTlRWalpKN0g1c3BTdjVsT3pyOTlIUmhoTFVkdTd6UnQ3U21WeUNJZjJNdzhqaHY1d2cxU2RzSktYLUVHT1pJaTMyY2pzMjFTZEc5eTFQcG4zeGJCUXJCNGROanc?oc=5,"Wed, 14 Jan 2026 08:00:00 GMT",POSITIVE,0.9808,2026-06-23 01:12:01
bmw_b370450db2b5d663,2025 US Electric Vehicle Landscape: Market Growth and Regulatory Pressures - Morgan Lewis,Market Intelligence - EV Trends,2025 US Electric Vehicle Landscape: Market Growth and Regulatory Pressures - Morgan Lewis. 2025 US Electric Vehicle Landscape: Market Growth and Regulatory Pressures Morgan Lewis,https://news.google.com/rss/articles/CBMitAFBVV95cUxNbFJHbDVpN3loTC1BN1VZbTNud2sxM0N1LXV5d0tkUVJOQVd2M1FFVVJYUmRXTVBKXy1WengwanJnNmJyaG13OWIxVWdRREFMQTJZR1NlT192QzNKazlZRVdyLVNTczBySzlTNVdHak5JaGdpMXlmS09SOXpocU5ydEZNRnM5bXhKaC1KMjJyT3BkOWRPeVhDNmowd2VzbklkSWYzeVBlS3Vua0x2TlJrRWRLRV8?oc=5,"Mon, 15 Dec 2025 08:00:00 GMT",POSITIVE,0.9906,2026-06-23 01:12:01
bmw_355816edd38cbd51,EV Slowdown Drives Shift to Energy Storage Systems - S&P Global,Market Intelligence - EV Trends,EV Slowdown Drives Shift to Energy Storage Systems - S&P Global. EV Slowdown Drives Shift to Energy Storage Systems S P Global,https://news.google.com/rss/articles/CBMipAFBVV95cUxQRFREYVNLSzRJZTBPdHVBQkNidm1RY0w0MWQ1cE5KTXdzWk5YdGFhQkxTcVVsTTVfajBWc0QyTk1jN1Rfc195bFQ3WUE5QkRKU2FXdWIxMlA4eWhNMXhRbXlQLWVMQWpWVHdyVUhNa3pVTU8xQjdUejZ0Qlo4azFUNWxqWEpzMThmWEtuV1Ezc3EtdWlieHdtUE9sN0JlQUZxanExRg?oc=5,"Thu, 12 Mar 2026 07:00:00 GMT",NEGATIVE,0.9903,2026-06-23 01:12:01
bmw_dec16ae9f67d59e9,EV battery supply chain: the cost of a beautiful bill - S&P Global,Market Intelligence - EV Trends,EV battery supply chain: the cost of a beautiful bill - S&P Global. EV battery supply chain: the cost of a beautiful bill S P Global,https://news.google.com/rss/articles/CBMiogFBVV95cUxOMFpXRWZoYkFDdDNrd2ZncjZ3RkszZFVEYUFGLTVqRGxyTTlQS1c5VjRJTmRlczhhRGVOOWVIWjhEOEMyQ2NRb1hPWFpDTDB4czBiTzQ0RWRBS2FQR0RYU090al9MbWFURHRYaVlvR0dLR1pGTmR3Vy1VczV1MTlZLVpwMzBXdm1DUXJOay1VZWxMWlFiY2hITVA3UWxVNDFOaVE?oc=5,"Fri, 14 Nov 2025 08:00:00 GMT",POSITIVE,0.9983,2026-06-23 01:12:01
bmw_ac55d87dbaa9ac75,"Automotive market trends 2026: Navigating volatility, innovation and opportunity - S&P Global",Market Intelligence - EV Trends,"Automotive market trends 2026: Navigating volatility, innovation and opportunity - S&P Global. Automotive market trends 2026: Navigating volatility, innovation and opportunity S P Global",https://news.google.com/rss/articles/CBMipgFBVV95cUxOTmZQcU15TkdlcGJQWldpb0owTklVSTlobFVzbFpRVmwzRUZYS0FINlQzLVdaaWtmZVN2LXZjY3Z3dmZBaHAzbTRkSk55aDI1MnhnWTQ1WG8zUkxwdmxPVy1BU09IMDBUNDRfNVQ2RV9uV3d6UGlpV0w5UXdQUk5fd01CZmZsSGlPM2ZCOWZPU3ktSDNlTnNSVGlGaDVNQktfOFJjUWlB?oc=5,"Thu, 15 Jan 2026 08:00:00 GMT",POSITIVE,0.985,2026-06-23 01:12:01
bmw_b25fa97cc58e89ba,US–Iran war continues uncertainty for global auto industry - S&P Global,Market Intelligence - EV Trends,US–Iran war continues uncertainty for global auto industry - S&P Global. US–Iran war continues uncertainty for global auto industry S P Global,https://news.google.com/rss/articles/CBMirgFBVV95cUxPSm41LUR2dURDSERZbzNWQ3lOWEdZd045eFBsclBoME9JQmctOXBpemE5WHM4WHQwQkNzdUFfWGNVejBuWnctS2FmUjhMU3duZk9DUmxEeFU0QjVJemdVLXNOUnBYT0VWd2hXVzZxMWwybWpEQm1LaUMySHk3WmRJby1QZV91akpkMWNDZXhQWlRYam5UaUNmSnRoSzRHSno1NzQ4WUlHSFpma1VhcEE?oc=5,"Fri, 03 Apr 2026 07:00:00 GMT",NEGATIVE,0.9923,2026-06-23 01:12:01
bmw_9ea4020b932462e5,Five projections for the 2026 automotive industry outlook - S&P Global,Market Intelligence - EV Trends,Five projections for the 2026 automotive industry outlook - S&P Global. Five projections for the 2026 automotive industry outlook S P Global,https://news.google.com/rss/articles/CBMisAFBVV95cUxPMFZZMWJNdkdneVMwTEJkbUNMZmNDQWZWNnp0TUVOOGJ1UW94WDNKVjExRXEwVXQwYWQ1QVZXWXlvaFoyMko2NllaUk9JUjdwaEJHbW5wN0s5VkQ3dE1WeFRqdkFVcjRfV2M4MV9jVFlsRGNXOVdtM0VIOE12ZE9ZNEpTOERSV1dnSXJRaWJEdjIxc3dHMVd6UVFwM1NOQ25JTHVCNGk0UmV1X0w5V2ZTUA?oc=5,"Fri, 30 Jan 2026 08:00:00 GMT",POSITIVE,0.9553,2026-06-23 01:12:01
bmw_15574c5290797585,Global EV sales reached 1.75 million units in March 2026 - Benchmark Mineral Intelligence,Market Intelligence - EV Trends,Global EV sales reached 1.75 million units in March 2026 - Benchmark Mineral Intelligence. Global EV sales reached 1.75 million units in March 2026 Benchmark Mineral Intelligence,https://news.google.com/rss/articles/CBMiowFBVV95cUxQWkZsWHVUN3EwYkFBd2xkaUgxcnRaRm55SUtXTlZsQWZvUUh3c21ibU5TVmRHNDBkNWZRYTkxY0RIaC0xMDBYeGtjUjVsbGJ3REJXUzhDRnNyM1I3OTd5TEl2MGc0M241VkJWSDNxaG53cGVDd0pYLTB4X3RHV0FJRXpfX1A5NTVsNTE4MWQyUXg0bnhMUDVFNl9CcjBHZFlBb0dZ?oc=5,"Tue, 14 Apr 2026 08:56:19 GMT",POSITIVE,0.96,2026-06-23 01:12:01
bmw_5e1bc5736112e031,Global EV sales reached 1.1 million units in February 2026 - Benchmark Mineral Intelligence,Market Intelligence - EV Trends,Global EV sales reached 1.1 million units in February 2026 - Benchmark Mineral Intelligence. Global EV sales reached 1.1 million units in February 2026 Benchmark Mineral Intelligence,https://news.google.com/rss/articles/CBMipgFBVV95cUxQQ2Uxc2VGd045cEhBSDNKTHNpdm5vR2szU1Z6RXFVM1JTa1ljdm9oN0tLYXhZTUFHSnphem82SExYSEFPNWlxaXVzR2YyRHJBZmJOMXJiLWRyei1JSjVPYUxyVWVmaDlrUjZvZlp1dDlLUjZhWGdmUnhkWGFhVURXMzc5ejRLNlQ4TGFaRkd5VjBXSG5ORkhJWURfTW5wVnpmQ3JQME53?oc=5,"Fri, 13 Mar 2026 09:00:23 GMT",POSITIVE,0.9427,2026-06-23 01:12:01
bmw_b64ed88aec82662c,January 2026 US new-vehicle inventory trends: Hybrids surge and EVs adjust - S&P Global,Market Intelligence - EV Trends,January 2026 US new-vehicle inventory trends: Hybrids surge and EVs adjust - S&P Global. January 2026 US new-vehicle inventory trends: Hybrids surge and EVs adjust S P Global,https://news.google.com/rss/articles/CBMihAFBVV95cUxON2l0c0QxMTRYak8tZFpUakFCNEN0SVpZa2lwZTlwYWlBb2F4Rk1rUXhrX3BISVVaczhrUm9YanIzUHNRdkp4TWZmZGo3MEtyRGNERUo0b25OS2hhcE9uZEJmMFp3TDM0TnJXV3ZWc2JZakM3VHp2UUdaa0FwM21aX3B6b1Y?oc=5,"Mon, 02 Mar 2026 08:00:00 GMT",NEGATIVE,0.9679,2026-06-23 01:12:01
bmw_3279ee8f9b276542,"Automotive industry outlook 2026: electrification, pricing and M&A - PwC",Market Intelligence - EV Trends,"Automotive industry outlook 2026: electrification, pricing and M&A - PwC. Automotive industry outlook 2026: electrification, pricing and M A PwC",https://news.google.com/rss/articles/CBMingFBVV95cUxOeHkyd2FvZUJEaUJEZlNaeFJQb0xNNjNka2EwS2hjZ1F3dFk2TVJubmsxTVZxc3ZnY2xLMG0ya2M0QlViV01qcDJid3JKODZMZGFiakxsWkpUOGEwMVlzMHNKaDhDWU0yU1pxcXBPbjZ0UDA4SklTV0lpYU16c1luUXJJRHRYay1iZ2NEUlUxeXM2aWQ4TDhxYll0WFgxZw?oc=5,"Fri, 30 Jan 2026 08:00:00 GMT",POSITIVE,0.9587,2026-06-23 01:12:01
bmw_c854ddf35264b0aa,Lamborghini scraps BEV launch plans - S&P Global,Market Intelligence - EV Trends,Lamborghini scraps BEV launch plans - S&P Global. Lamborghini scraps BEV launch plans S P Global,https://news.google.com/rss/articles/CBMingFBVV95cUxPblBxRDBaT3FmbjJWSG5TUy1OZjN6TFVOczhaY2UzRjNnQzZCbVlvSW1FaUpkWFFQUWdwTGF0Y2FjdDBxREgwUkZ4ejJ6WkxkMXFJQ1BXUTlxY045VERBT1hHcnVJRUxiMkdRWjVmVnJ2eUxzZ3JCQmdaelNtaVdrMUpRNk44YVBoaExSTmZsM1VEd0VOQUdmZ3NfdGtVdw?oc=5,"Thu, 05 Mar 2026 08:00:00 GMT",NEGATIVE,0.9996,2026-06-23 01:12:01
bmw_71054ed0a9eedce5,Building an entrepreneurship model in Indonesia’s electric vehicle industry: struggling or sustaining - Frontiers,Market Intelligence - EV Trends,Building an entrepreneurship model in Indonesia’s electric vehicle industry: struggling or sustaining - Frontiers. Building an entrepreneurship model in Indonesia’s electric vehicle industry: struggling or sustaining Frontiers,https://news.google.com/rss/articles/CBMilwFBVV95cUxQU2NEdVNfQ093cVJ3eGFyN0R5SlByNkFJeUNEVlUySnNrNV9JbUJMd2xhSlctWGJUVElKU3E4QlNmdllhR014Skh2WldTNnh4ZU5DTFVsejJwaHFXSC1JZ3hwMUcwTEJ3M0lKQVhkaWxmZUtfMS1HbWJzdVRBU3Q0NUdnZGthYVJZa1BnM1pnLXE5VHI3V3Jz?oc=5,"Sun, 11 Jan 2026 08:00:00 GMT",POSITIVE,0.9973,2026-06-23 01:12:01
bmw_c9b34ad2b2a80d97,Electric Vans Business Research Report 2026: Market to - GlobeNewswire,Market Intelligence - EV Trends,Electric Vans Business Research Report 2026: Market to - GlobeNewswire. Electric Vans Business Research Report 2026: Market to GlobeNewswire,https://news.google.com/rss/articles/CBMi8gJBVV95cUxQYW9DSy05SXZMandOclVFY3RzN1l4OXNEVFdXY0JEcUdaZUlMTXQxZ0hhQjM5Y2M2Tk5aamJVSHdxTDQ3WGU5bkJqNlN5ZHZFMXRvX3pxM3dtUnE1NmlNYWJZRVhWck5qejVMS1dTV28ybEhsaFVRZDI3RmRxZGhaQTU4a2FhdFBBU19OUVZFSHp2d1lvZmR1SFlsYmM1RGRITW1nSVMzd1RmaHhvOFY2NjhEVkJKQ2dXMkNxQVBsY1V3YmVobGVHZHRTTW1nX3NRMGgzOVZOV3VsR19zSjh4WkJTRm80a3lhVTR1QjJ6Z2ZTY2RoZTBwdTFWTDIxLVl6ZjRHMHJPcm5fZnZsY0NVRy11Skx3TGNQdGROZDhSQndpSDRXVi1VaE5kSlh1clR1eEhfRkV0ekFvcHFuN2gzRFEzY3lpOVF2UUpjb1BUSElyYWtwVW9qRktiMmFPNzFHOElfVlhaZ3MxdHROTTF1Q3dR?oc=5,"Tue, 28 Apr 2026 07:00:00 GMT",NEGATIVE,0.9014,2026-06-23 01:12:01
bmw_1ccc9c828ffd703a,May 2026 light vehicle production forecast - S&P Global,Market Intelligence - EV Trends,May 2026 light vehicle production forecast - S&P Global. May 2026 light vehicle production forecast S P Global,https://news.google.com/rss/articles/CBMilwFBVV95cUxOR2JFdkV4Ym9nYTFTWnZWVl8tRld6Uml6YWJ5OWRBWm9ya3hEaE5hMVRYTzV4NzNxS0lTRGgzZWZDa18yeXRKTGFCdmZwR2xnejFXTDRhZWNMTDZrZjlReG9keFhKa3NDeEZBdEVqejhsSDNLNHV2UXF5Mm5mWG5hRTlYNmVESXJHV3dVSHA0NWd6dlZjd0Ew?oc=5,"Mon, 18 May 2026 07:00:00 GMT",POSITIVE,0.5739,2026-06-23 01:12:01
bmw_7e46d0a2608cda06,New Data Puts Ethiopia Among Global EV Leaders - Energy for Growth Hub,Market Intelligence - EV Trends,New Data Puts Ethiopia Among Global EV Leaders - Energy for Growth Hub. New Data Puts Ethiopia Among Global EV Leaders Energy for Growth Hub,https://news.google.com/rss/articles/CBMiiwFBVV95cUxOOVVLeUgxTHhkWmJoWnJWWHlTRXhYM2JtSE1ZV2sxaUdtQlM5ODhLcWlIZTRob0k3TWdqNlF4Z1VMVXBTbmttbEdwWWNxeURlVjF4QWZTLTFENDNfdjVaX1hDdl9UbV82YjVpRlhYTmtoN0VkQTdhNFNiMDQ2aWg3a2M1c2JybTdTQU80?oc=5,"Fri, 17 Apr 2026 07:00:00 GMT",POSITIVE,0.9985,2026-06-23 01:12:01
bmw_621c200ceb2d92d6,Discover 2026 automotive aftermarket industry trends - S&P Global,Market Intelligence - EV Trends,Discover 2026 automotive aftermarket industry trends - S&P Global. Discover 2026 automotive aftermarket industry trends S P Global,https://news.google.com/rss/articles/CBMiogFBVV95cUxPNUpJSXFlNUh6Q1FZRlFPRDJZRFduUjVndjVmSEVPZGxRX1lMVGJfcVYxV2V3emlLS1VTNjJZM3pxOEZQSTBWNlRVQTNZT1ZPZEpEdWdXNUwzMmdHZFR4Qms1OGVZTGhJX1h3UGlCTk1TajZjd01lZVNLb3YtT3JfY0JKdllZSG5KYkdISUxxSWUwcFVuZnpZeDJNdFdoX3p0VEE?oc=5,"Wed, 01 Apr 2026 07:00:00 GMT",POSITIVE,0.9949,2026-06-23 01:12:01
bmw_11c3fb20c7fe6a64,"U.S Electric Vehicle Market Share, Growth & Analysis, 2034 - Market Data Forecast",Market Intelligence - EV Trends,"U.S Electric Vehicle Market Share, Growth & Analysis, 2034 - Market Data Forecast. U.S Electric Vehicle Market Share, Growth & Analysis, 2034 Market Data Forecast",https://news.google.com/rss/articles/CBMiggFBVV95cUxQNWxIdkIwV0RuWnhSbzdZMHF0UTNJcXExVFFBRi16QXptLUVSU2hMZURUcnhWT2pRR2F1bmMtNHduWXlGbElvRHh5RUQ0S093SnYwb0c4R3AtU3RXWHE5Sy1yOVRvQllHVzQ5Wkk5VGFnbGlVN1RiT2xfdUNZeDFRR0pB?oc=5,"Fri, 06 Mar 2026 08:00:00 GMT",POSITIVE,0.9733,2026-06-23 01:12:01
bmw_be6f8c9d87d6643f,The price premium of hybrid electric vehicles - S&P Global,Market Intelligence - EV Trends,The price premium of hybrid electric vehicles - S&P Global. The price premium of hybrid electric vehicles S P Global,https://news.google.com/rss/articles/CBMiqwFBVV95cUxQVEMtWEUzdGU3RU42R2hzX1RFeTdPbjNYZW96VVRBa0JlaDZwUlNuR1FnVmNIdVZfd0hTRExjNFVRejY4dS05elhMdHhmTnlzcl9iM21reEoyeExsd2NhaGF6NnZZVnNYU0duOHRleTM1ZHhIZkRBRTF4QVh6TWV4RDktMXcxeHRPTW0ybHhLOEtMdWtCQmlXYzhzNUdUa1hvQnVCVmhlNDdUTTQ?oc=5,"Wed, 18 Mar 2026 07:00:00 GMT",POSITIVE,0.9928,2026-06-23 01:12:01
bmw_74aefee2744661ab,Why automotive data gets you far and human expertise gets you further - S&P Global,Market Intelligence - EV Trends,Why automotive data gets you far and human expertise gets you further - S&P Global. Why automotive data gets you far and human expertise gets you further S P Global,https://news.google.com/rss/articles/CBMiqAFBVV95cUxPYTZVZFNLMXZpeXdvSHlnUWdfWDBTLVM2RmliX2p6TldDbVlEOHdNVGRjMnZ3V1hLVEZheU4xZXFFUEwyS0xrVnFoVmFUQkx0MjZkams5QjVONF9sZ1NwYnFBa1RjOGxKekVGSkw0M3VMNFJoZS1jdzZrWHZyZU1xbjAwQ2x1U3ZxTzRsSnkwTFdHWk1wdzBBZm1FbGR3Mlo5ak1PUGNhQnY?oc=5,"Mon, 12 Jan 2026 08:00:00 GMT",POSITIVE,0.9969,2026-06-23 01:12:01
bmw_bf3d08786788eab2,Global EV sales reached 1.2 million units in January 2026 - Benchmark Mineral Intelligence,Market Intelligence - EV Trends,Global EV sales reached 1.2 million units in January 2026 - Benchmark Mineral Intelligence. Global EV sales reached 1.2 million units in January 2026 Benchmark Mineral Intelligence,https://news.google.com/rss/articles/CBMitgFBVV95cUxQZnRLU2tsT0k0cXUyYzBWNzhFbDBXSTNGanpUVHlSTWd3eFZUdTdMVXRsNDJEc1JtSTl5RDBXQW54R2xRSGplVUlyVXlVYnZxYmZkTlZ3aWtkdFhXS0hzWTAxVmpXVGNZSUNEZ0VfZ0NVNGszbU14bVIyT3F6aUItNDZsM2pKVFlEZzkzOFFJcjVicEE4bXQydHZCbHBwRmRVZHVWMDBldWtxTUc4TGVEcWw0aTFIdw?oc=5,"Fri, 13 Feb 2026 09:10:32 GMT",POSITIVE,0.931,2026-06-23 01:12:01
bmw_31bac83b3798fd36,Electric Vans Business Research Report 2026: Market to Reach $34.9 Billion by 2030 - Global Trends Toward Sustainable Logistics and Circular Supply Chains Sustain Long-Term Market Momentum - Yahoo Finance,Market Intelligence - EV Trends,Electric Vans Business Research Report 2026: Market to Reach $34.9 Billion by 2030 - Global Trends Toward Sustainable Logistics and Circular Supply Chains Sustain Long-Term Market Momentum - Yahoo Finance. Electric Vans Business Research Report 2026: Market to Reach $34.9 Billion by 2030 - Global Trends Toward Sustainable Logistics and Circular Supply Chains Sustain Long-Term Market Momentum Yahoo Finance,https://news.google.com/rss/articles/CBMiqwFBVV95cUxPcEdKNjFDOWk5dTFPdExqVXJIa3VMMVVpdlBUOS0wTlVfcmZheGR2YVNMcS10QnRZV3k5MHVfYWJYeXoyV0VSQmRlaDBGOVhwTVVQNko2clRDX3FDcGIyS21PSUtHeUdQd1hNZUVUV1hjaVJKZ2tuQUVteUJMeXdrS1RHOU55VWd3cndpNmxkU1FoYnJDdFZhbjFiLVFVQlNueXdvMmJxVkRuakU?oc=5,"Tue, 28 Apr 2026 07:00:00 GMT",POSITIVE,0.9905,2026-06-23 01:12:01
bmw_76550b5d45d50a30,Economic implications of war: Middle East war and the automotive industry - S&P Global,Market Intelligence - EV Trends,Economic implications of war: Middle East war and the automotive industry - S&P Global. Economic implications of war: Middle East war and the automotive industry S P Global,https://news.google.com/rss/articles/CBMiugFBVV95cUxPZ1VwbjhtSE1xdGo5LXI1R1d1VXB3TmJaRE1BX0hjYWVUWjZ4ckV4V09hdFdoSEh4OEowd1JDNkNqRzZYR2tqU0s5Y0Jxcm9jMmk5MFJTcUd0OS1qdzYtaHVXbFZNRHFUY2V2TWNuWmFCS1J0Q3A5U3JnVV82VTdJcWtZM3JSeDNDSzlKc2xvYl9OeWhibFBlbTFMRmt6XzM1VWtzWVEtYkxVV0E5VmlsTjZKcktEc3JHMmc?oc=5,"Fri, 06 Mar 2026 08:00:00 GMT",NEGATIVE,0.7664,2026-06-23 01:12:01
bmw_e5c888e2afb3de33,Why is the War in Iran Driving Sales in Electric Vehicles? - Supply Chain Digital,Market Intelligence - EV Trends,Why is the War in Iran Driving Sales in Electric Vehicles? - Supply Chain Digital. Why is the War in Iran Driving Sales in Electric Vehicles? Supply Chain Digital,https://news.google.com/rss/articles/CBMiiAFBVV95cUxQT2V2cTM0cUlHejNibzk1VGxmZk5XSHFURWlkZU5MLTU4U3RISUdCN3dzTzZmLVVacFlZQ0pMYkdTMjVrZi01eGVPRVJ1T2RERTAwYlNORUpLUmh4T1pQWDZINHF5Z0VUV19lUEs1MmY4Z3llTkFNR2pDczlVVXZ3YlZHa0RMOGhP?oc=5,"Wed, 25 Mar 2026 07:00:00 GMT",NEGATIVE,0.9985,2026-06-23 01:12:01
bmw_6375c54d66163c53,What's fueling U.S. consumer interest in hybrid vehicles? - S&P Global,Market Intelligence - EV Trends,What's fueling U.S. consumer interest in hybrid vehicles? - S&P Global. What's fueling U.S. consumer interest in hybrid vehicles? S P Global,https://news.google.com/rss/articles/CBMitAFBVV95cUxQYWFvQTRvdHBpc3hGTjVwcE44R3ctYmU3cFQxUGxaWkR1XzAzOFZTMkhseTRlTjh1RDZucTNEc1pVN1hXaGktRTJTd1Q4d244NENjTTFpTjUwS1ZETzNqb0JKTTBQSXJ3bG5Rd1pBZU0zNTdOUmxPVVFQUk0yZW0zU3JkT3psWUNWR2Z4cTRhUnp4SjdMdm9JdmM4RmZJX2NDU3VTM1p6LVNET3dRTjlDTnZGdGg?oc=5,"Wed, 26 Nov 2025 08:00:00 GMT",NEGATIVE,0.9839,2026-06-23 01:12:01
bmw_3a06bff48af0f13e,Mobesity: The Growing Concern of Large Electric Vehicles - AZoCleantech,Market Intelligence - EV Trends,Mobesity: The Growing Concern of Large Electric Vehicles - AZoCleantech. Mobesity: The Growing Concern of Large Electric Vehicles AZoCleantech,https://news.google.com/rss/articles/CBMiZ0FVX3lxTFBaOG10aWN3c1pSZklzQUpqQXpQVjRiUjJIRzNhRHdkX3hGUlRVMi1kb2JTMEhNbkMza1VsUGxSU3hjQmlRai1oeUpVNUlSVmJpYTFTNTFfVE1tUFVHSUh4Q3dYNHhjeE0?oc=5,"Wed, 10 Dec 2025 08:00:00 GMT",POSITIVE,0.8275,2026-06-23 01:12:01
bmw_6b269d0c31899dc7,How the rise in electric car sales is shaping logistics: Video - Maersk,Market Intelligence - EV Trends,How the rise in electric car sales is shaping logistics: Video - Maersk. How the rise in electric car sales is shaping logistics: Video Maersk,https://news.google.com/rss/articles/CBMiqAFBVV95cUxNMk5nR25ud28xUmRua3IzUlBFbl9BLTNjdGhwRVo0RGZXOGpOLXViOUJIVlpVNGJ5a01adDNxZDNnSEVaejExQVFCQ3pHUEFmUk9Ic2hoY0dTM0FQMnJ2RW11N3JPMDRpR3lDTFNKMXRySTNxZ0VURGhhN29NRDV5NkFLRzM2TDkwRDJJaFVSeUdfRXE1aGdiY1VYWTgtdzFCUlV2eVN4Wkc?oc=5,"Thu, 04 Sep 2025 07:00:00 GMT",POSITIVE,0.9675,2026-06-23 01:12:01
