id,title,source,content,link,published_date,sentiment_label,sentiment_score,pipeline_run_time
bmw_f44b7e64243f914c,Business News - LatestLY,Google News - BMW Corporate,Business News - LatestLY. Business News LatestLY,https://news.google.com/rss/articles/CBMilwJBVV95cUxPQWlUaUVJUkFKTlZWMFQ1Zkp0MERSSEpuNFg0a1NYbkNpSTZUc2RXTE94T1dzX1k2YlJpdkhyay15eDB2QUdYY0pQXzFwUHBKeHZMdnJFd1p3OWZFTGFuakFhd19MQ1MxbHdKOVdaTXhTeHBCdXlCSGJHOGtxbUpTbDdqdDQ0RTYzeFlYWThPX1ZlWkFBeUVEQlU5ZmlUdTlkeEFoMFFIa20wN3h4YjhMalpDV3Z5aHE5RXBYVzl5eXBPb3J5ZGhUVmZUcVFfZUdtSWRialAwN01tY21ZOHEydFp0WkI1TVVkQWZZR1dpbm5mckE5Q2tNdUk5RTZTdHhJSjJhZ0tGYVNQaUxUalc1SEJmdVNPajjSAZwCQVVfeXFMTURiSVNHRkxYeHhPcVVpekROdmVWWU8tTVZSZU1sUVdjN1ZyWmJ2OUt0TDZkdmpkR21RdmdkYWJaUmx3Ti1DSVF0clZPcUlxcmJENlJzaEk4QnVzUFo4aHE2NUxIOU1Xcmw1ZnNSN3VwVWc1S0kxQW1iZW0xamxVLUVRdTlRWTFfTC1MaHpEOU5jYUhuVUVSZWJDVXhnVG9ydnlMRmdOdW5HWXhXbzJENTJIMGtxak50SjlDbkItQ3NBTVFhYXM1akhPWU1lcGtDdW9DQzZ5T2xGZEtuaV9uYzM3QU1pRXV2WG1iSnhfSHQyZlE1TE9zOUJsMjlLLXNSeVUtbmFaMlo0N0d5TEFRV2wwamtiU0pFZXRtb2g?oc=5,"Fri, 04 Apr 2025 07:00:00 GMT",POSITIVE,0.9841,2026-06-23 01:12:01
bmw_92b195a8435fff2f,L&T Tech Services wins 5-year order from BMW Group - Mint,Google News - BMW Corporate,L&T Tech Services wins 5-year order from BMW Group - Mint. L T Tech Services wins 5-year order from BMW Group Mint,https://news.google.com/rss/articles/CBMirgFBVV95cUxNd0dDdTVwazBPMFdzbDBfVFNSRUU1V2tCYVBFMUloRUlqV1JFTkpsRURSZVpYb0pUZk1oRDVqRnkxeUtGQjREZG5wNXExWUYxN0l1ZW94WmNQX25IUkRqTWVrd1NJbkhlOTR6Y0EwbUlMcS1NZU0wNXgwYXRldmlLRTlDeGZDVnZpMU1GaUtsVGxMSmU4eWJDWEk1cGotQmpLc1d5T1NxS2Y5SERsRmfSAbMBQVVfeXFMT2syS2ZhakVpSC1MZXRHZTFwRlRjOHhHczNmelppc21zVjRLbEV2cVRrZmRnXzhtU1JQQzZDX2s1TGtBOENmaUFrOUU3Q1AtMDMyMGRVOHcxMGZRUnZRVnBHMnBCbngyc3NoWEZLZ2FNaGR1cEVEU1lzQmVybm1vcEJLZjNIM0VpY0UtblR6MVlicllQUjRjdjlaMVlYLVRHV1VreTg4RFJrcmltTkVKRFZXWG8?oc=5,"Mon, 29 Aug 2022 07:00:00 GMT",POSITIVE,0.9985,2026-06-23 01:12:01
bmw_f33fb2cee126266f,EV Market Monitor – April 2026 - Cox Automotive Inc.,Automotive News - Competitors,EV Market Monitor – April 2026 - Cox Automotive Inc.. EV Market Monitor – April 2026 Cox Automotive Inc.,https://news.google.com/rss/articles/CBMidkFVX3lxTFBHb0x2MmM2XzdaLXlLVEdEZm1jU05mNi1JRWd1VmdxM194SXVjb2tuU2xzaW1aaEJlR1E3LWdTZEtTa3htbG5jb01jbmFNd0sycHBackx2TEhNVHRsS2hWek1WSWlhWmplcnpNYVVCdnVXMVQzV0E?oc=5,"Fri, 15 May 2026 13:04:05 GMT",NEGATIVE,0.965,2026-06-23 01:12:01
bmw_537860f00ad9e5e3,"Mercedes pushes ahead on EVs because global demand, regulations leave ‘no choice,’ U.S. CEO says - Automotive News",Automotive News - Competitors,"Mercedes pushes ahead on EVs because global demand, regulations leave ‘no choice,’ U.S. CEO says - Automotive News. Mercedes pushes ahead on EVs because global demand, regulations leave ‘no choice,’ U.S. CEO says Automotive News",https://news.google.com/rss/articles/CBMihAFBVV95cUxNZkxRTnVQbVVaaFRYZC1nc0tVU2FvT3ludDdTUmFNQ3JXMWNsb0c5REVGalp3UFRhcWFES0lpRFZNbG54RzlMcFRNbHkwWGNMMUllZC1UQ2xUMURWSTBlekZGN1BtaTJSd19ubHp4U0o4OVFyRWprWVpOUC03QktVbnhwblg?oc=5,"Thu, 02 Apr 2026 07:00:00 GMT",POSITIVE,0.9399,2026-06-23 01:12:01
bmw_b064beca140edaf8,Is Tesla Losing its Grip on Europe's EV Market - Kavout,Automotive News - Competitors,Is Tesla Losing its Grip on Europe's EV Market - Kavout. Is Tesla Losing its Grip on Europe's EV Market Kavout,https://news.google.com/rss/articles/CBMiiAFBVV95cUxNMk5rajFmRS0tcEFOVkdIUEZvRC16SnJVQmEwdENfWkgzWmNmR2YxeG9QLWZ5V3VZZHFaOWtNNjJaMWVlY0plT1ZhNi1RbTZzZWVzcmpNdmFVaGtBOHBOdUJBU2RjQjlHTGd0Y3BKY3VCT1RwalVhTDl4ZmFKTDV6Rko3SHJiVWtS?oc=5,"Tue, 24 Feb 2026 19:29:56 GMT",NEGATIVE,0.9998,2026-06-23 01:12:01
bmw_ee1f936e4e0c9943,Tesla US sales drop to nearly 4-year low in November despite launch of cheaper versions - Reuters,Automotive News - Competitors,Tesla US sales drop to nearly 4-year low in November despite launch of cheaper versions - Reuters. Tesla US sales drop to nearly 4-year low in November despite launch of cheaper versions Reuters,https://news.google.com/rss/articles/CBMi3AFBVV95cUxQdmI5SmY2YnhMWU1NQ2ZocDlUdi1JWmtaVl9ySTBLWG1ZMjdtU200eV8yeFowU0lSOTRxWGstVjBtYzJOUWtLeTltVFcwVzVyc1pVRmF4a0tvT0h4LXJGRHVwR0Y3SnE4b2dvcmdjem1HMllfbzJOa3RyZEs1SGZFOFRfSmVQNmhBSndBeU5qZEQ1ZWo2R2Z2RTJrYzBKMEtqUzlJZ3Fxb01SWjZTaGRRaU5VN0xiNlZvMEN2dlZMZkpzQW5neFRQY0xhTUJzTURtSDh3elpmWEFWeGtW?oc=5,"Thu, 11 Dec 2025 08:00:00 GMT",NEGATIVE,0.9989,2026-06-23 01:12:01
bmw_021bf6a9229e5778,Xiaomi hires Tesla’s former head of sales in China to lead its auto retail push - Electrek,Automotive News - Competitors,Xiaomi hires Tesla’s former head of sales in China to lead its auto retail push - Electrek. Xiaomi hires Tesla’s former head of sales in China to lead its auto retail push Electrek,https://news.google.com/rss/articles/CBMilwFBVV95cUxPVWowSGw0UXVvN0tLel9XZzQxRjUwY3ZGZUdpcm9KVzloMEgxeWtMbllpN2UwRzc4a2lfR1NVQkdnQld2UndfN2FNLXhfWUpIMzdRS1NFOUpnWm03QVVyendnQ29LT095dE5JbHNDYmN3R0Vka3JadEJpWmFMZVFGVDFkSURiYW9MNno2cG04RmhOcktFbTBZ?oc=5,"Wed, 01 Apr 2026 07:00:00 GMT",POSITIVE,0.6952,2026-06-23 01:12:01
bmw_fdefe0c51b3afa7a,BYD Surges Past Tesla to Become World's Leading EV Brand - Statista,Automotive News - Competitors,BYD Surges Past Tesla to Become World's Leading EV Brand - Statista. BYD Surges Past Tesla to Become World's Leading EV Brand Statista,https://news.google.com/rss/articles/CBMigAFBVV95cUxOUUdrU0JMeERQemJwczFQQVFMTmxDQmRpel9mRkwxQkUxU0lpTFJlV2ttaWdLcWhoUnNRc1ZpZEpkajNDTVZkY3BIa1hRNmJqVnJmckFvQWFNMzVQMUk4YXJBaUt4YW5fdjlsWlJzNkVLa05hZG90R2Q4elZEUk1HZNIBhgFBVV95cUxNRHJ2SEdhdWRrMkNkN29yZkRvdjB0RXN4WklvcVlhT3NlWTBPOUJybjd3VktvU2JFUzBQaldpei1ZbjZRQUZqQ2E0SGRldTlyMWtvTV9obUpMLXhxeWlTeEVHMFlxMnRtQ0N6cHpwZXM0NV8wOXljQjFrWDZnUnBVbG5mTnZjZw?oc=5,"Mon, 05 Jan 2026 08:00:00 GMT",NEGATIVE,0.8642,2026-06-23 01:12:01
bmw_619c0ac765f13418,Tesla's Model Strategy: Risks and Market Challenges Ahead - Global Banking & Finance Review,Automotive News - Competitors,Tesla's Model Strategy: Risks and Market Challenges Ahead - Global Banking & Finance Review. Tesla's Model Strategy: Risks and Market Challenges Ahead Global Banking & Finance Review,https://news.google.com/rss/articles/CBMiZ0FVX3lxTE1KNkdYcTlVcXVmMW9OYlJEWkVqQUo1UWlQZEkweGdiUXQ3OTlEbUNGRktoZUgwWi1PSk5ISUJ6VmZSNjlTdHk1LVREVnlicC0weGZMTTFMYTRSV3lTcmN6SE54RV80S3c?oc=5,"Thu, 23 Oct 2025 07:00:00 GMT",POSITIVE,0.9975,2026-06-23 01:12:01
bmw_91b616995d37ccc0,"Tesla Cybercab at $25,000: The Unboxed Strategy Explained - BASENOR - Tesla Accessories",Automotive News - Competitors,"Tesla Cybercab at $25,000: The Unboxed Strategy Explained - BASENOR - Tesla Accessories. Tesla Cybercab at $25,000: The Unboxed Strategy Explained BASENOR - Tesla Accessories",https://news.google.com/rss/articles/CBMilAFBVV95cUxQSmc3Rm4tSXROaHlGamdodkdEblNYb3QtT3N6WU8xMXV1WmlSR1dnTndRRnNyOHFuMldGRkYtZGtCNUZ0REZuRGdpWjJveDdyNlJPOGI4TkRhbnpkR2RJV2ZuenFCWmVDc1phUkVnN3JQeWswYlNBVjU0SjlWU0JIWHdvSGNTZGlyelF0VjIzMzl2V2U4?oc=5,"Fri, 13 Mar 2026 07:00:00 GMT",NEGATIVE,0.9937,2026-06-23 01:12:01
bmw_22e367c2dc6a27d4,"Tesla at a Crossroads: Sales Slump Meets Regulatory Headwinds But Stock Rises, Why? - CarbonCredits.com",Automotive News - Competitors,"Tesla at a Crossroads: Sales Slump Meets Regulatory Headwinds But Stock Rises, Why? - CarbonCredits.com. Tesla at a Crossroads: Sales Slump Meets Regulatory Headwinds But Stock Rises, Why? CarbonCredits.com",https://news.google.com/rss/articles/CBMiqwFBVV95cUxOVWhwUVF3aTNTTlZSX05EV2VMOUVkaF8wZUh6aDhKWDc5b1dSNVdvMl9QSlZ5d21OcV9jQmxIU19lZ0p4amZiMTN5Q3RYNjA3RXpGYVFTQXdfcGdBTVY2YV9sMDJYcU15bklabnFUcTFacGgyUFVKeHVuSXJWWXl4RTVQZzF5NGVOZjFFODZFaHA0WGxZY0R0UUp4cUhhYlVTUVFSRjdUU0dzUFU?oc=5,"Thu, 04 Dec 2025 08:00:00 GMT",NEGATIVE,0.9959,2026-06-23 01:12:01
bmw_18574ad7bf9ec765,How Mercedes-Benz Is Course Correcting Because Of President Trump's Tariffs - CarBuzz,Automotive News - Competitors,How Mercedes-Benz Is Course Correcting Because Of President Trump's Tariffs - CarBuzz. How Mercedes-Benz Is Course Correcting Because Of President Trump's Tariffs CarBuzz,https://news.google.com/rss/articles/CBMihwFBVV95cUxPZi03TEpLZkowSnhzbWdobERxTEhoRlFndFFjNlNKTnNYajNWSFhsRktmTm9wcGVhM3RxX2wyOU5vdXA4TzdlaFdiN2J6ZXBVSHRadERFelBmZ3NmdUFSSkRfLU9oMlFEazU0d1FvMHpUcWkyZ05zSjhvOHJod0VHUzFfb0xTSVE?oc=5,"Tue, 17 Feb 2026 08:00:00 GMT",POSITIVE,0.9512,2026-06-23 01:12:01
bmw_397e4e56e95f6fc9,Pressure grows on CEO Ola Kallenius as Mercedes-Benz’s luxury strategy stalls - Automotive News,Automotive News - Competitors,Pressure grows on CEO Ola Kallenius as Mercedes-Benz’s luxury strategy stalls - Automotive News. Pressure grows on CEO Ola Kallenius as Mercedes-Benz’s luxury strategy stalls Automotive News,https://news.google.com/rss/articles/CBMifkFVX3lxTE52Nmh4dktFanlNSERnM1RDSk96S3Q0ZnBCYXc0RUNzMl9vUHdNa3FraW53UE5XS0YtM0JYWGlUWDlpZWhDbWVaWVVWUFQxWWVDSDBoSEhiU2I1dzZQN0Z5RVRjX0lIRE9UdlZHeDVlcV9GZG00ZWxXbVlyemx0QQ?oc=5,"Mon, 01 Dec 2025 08:00:00 GMT",NEGATIVE,0.9993,2026-06-23 01:12:01
bmw_8ea79a1f9d1cbbc8,Mercedes keeps 'value over volume' approach in tough Chinese market - Reuters,Automotive News - Competitors,Mercedes keeps 'value over volume' approach in tough Chinese market - Reuters. Mercedes keeps 'value over volume' approach in tough Chinese market Reuters,https://news.google.com/rss/articles/CBMirwFBVV95cUxOQUtDUUtLRGJtWXAwM0dZaTBfb2JzMk9EdGJBOGhHczlVXzFheWlLNVZiT1RvNTFoMll5Yk9JcE1qMEliNEJEci1qa25ETVhCekt4OFBJM3FmYm9Wems2bnZHVWp1THg3WUgyMTRqV1VSdjEwQlJEWVI1aWlweXpocmJWc2ZGaE02alVUeDJROWVYZTU5eHE5TzZMR1YzT3NlWDVQRV9sWWJGNVhxdkNv?oc=5,"Sun, 07 Sep 2025 07:00:00 GMT",POSITIVE,0.8004,2026-06-23 01:12:01
bmw_ebde3da1139bb26e,"Mercedes-Benz pushes for 325,000 U.S. retail sales in 2026 - Automotive News",Automotive News - Competitors,"Mercedes-Benz pushes for 325,000 U.S. retail sales in 2026 - Automotive News. Mercedes-Benz pushes for 325,000 U.S. retail sales in 2026 Automotive News",https://news.google.com/rss/articles/CBMikAFBVV95cUxOZzI0NGVlaVdpSGpQajZMWm9wRWxVZlFKS2VFQXlfVjFnaEpIMU1OZFdkLTJhMkJyMzExcklEUG1oSTlNYmVKYUU4Z3NzbWRhRWVNZ2Y2cWJoU0FON0hXbVotV0VkOHB3RGhzUzVCSW1uUVkyUXh5RTlqOHJ6VVYwN1VETjdNZ1l5QWdWX3pIa3I?oc=5,"Wed, 04 Feb 2026 08:00:00 GMT",NEGATIVE,0.6123,2026-06-23 01:12:01
bmw_754118079011b8e0,"Tesla unveils cheaper Cybertruck variant, cuts Cyberbeast price to drive demand - Reuters",Automotive News - Competitors,"Tesla unveils cheaper Cybertruck variant, cuts Cyberbeast price to drive demand - Reuters. Tesla unveils cheaper Cybertruck variant, cuts Cyberbeast price to drive demand Reuters",https://news.google.com/rss/articles/CBMiqwFBVV95cUxQRkNfcjNIZmduQXhleVlVcGY1YkJOa08zUERvak44bVZzMFg2UkhoRHkxQm5icGQySDhLYnAxdy03LXIxcGdhWG1vUXRWVXVXZENjaHNjUGdQSGNiVmlvVV9Rbk1WSU9LdF9IVF93b2dMb2RsVWRaVnFnYjNxZklqOGkySXdZc1ppRUE3MDN3MzBqZ2ItM19uV09BckZJcW9vNXh1UHhFMjlpbGM?oc=5,"Fri, 20 Feb 2026 08:00:00 GMT",NEGATIVE,0.9883,2026-06-23 01:12:01
bmw_5f63abf01e864d3f,What’s at stake as Mercedes tests luxury-first strategy - Automotive News,Automotive News - Competitors,What’s at stake as Mercedes tests luxury-first strategy - Automotive News. What’s at stake as Mercedes tests luxury-first strategy Automotive News,https://news.google.com/rss/articles/CBMiiwFBVV95cUxOMkpkT3hGQ0M3LWkzUnc1XzNtQkE1X2tQRk12c3dnazFsaVpuUGt4NlVrNHpobmJHaFlEdFRsOElKc083dnlDb1ZCTUJfSC10NHZKY2d0d3VaUW90eVNQdFJJb0doZXhVNVluY2dUaEtPMmIwbXVkakNLenV6TENtSms3LUxEMXNXUXN3?oc=5,"Wed, 11 Feb 2026 08:00:00 GMT",NEGATIVE,0.9899,2026-06-23 01:12:01
bmw_8def9607cb4a5c84,Instant view: Reactions to Tesla's launch of cheaper Model Y and Model 3 - Reuters,Automotive News - Competitors,Instant view: Reactions to Tesla's launch of cheaper Model Y and Model 3 - Reuters. Instant view: Reactions to Tesla's launch of cheaper Model Y and Model 3 Reuters,https://news.google.com/rss/articles/CBMiugFBVV95cUxNcFBuN19DRXpZTTA3cHkzTFJZT1Y2dmpjeG83X2owcTA3aXRjQWRNcTdvc21XUGhxdUhaT2pMU1F3OHhzVS1pUUFLakg5ODRwd0VpX3duTjIyTnlPYmV1c19JTkFnUlUwMXNEU01GdVUyYXlPUy1PNk5kREhwS0tIUkxNb2JpMUY2ekVCcVBZSkRncDJ4VzBJZFJJWlNLQkpzT01fMTJDVkJvbnF2MDBqajBKVTRrMEZoN0E?oc=5,"Tue, 07 Oct 2025 07:00:00 GMT",POSITIVE,0.9045,2026-06-23 01:12:01
bmw_91d3342bb7dcc456,"Volkswagen, GM, BMW double down on China EV bet at Beijing show - Automotive News",Automotive News - Competitors,"Volkswagen, GM, BMW double down on China EV bet at Beijing show - Automotive News. Volkswagen, GM, BMW double down on China EV bet at Beijing show Automotive News",https://news.google.com/rss/articles/CBMisgFBVV95cUxNM1dTLTR5TGk0NGhvNmdoYV9oc1BhaU03TW1qR2Exdm5sUmhiMUtKcDhPR05jU3I1aVZNUDlRQXluUjlmdnFWMm52c0NIekliaDUzanVxOVdWY2NYd1RTbkdSSkdRVjAxdFkwRjNGZzZnZ3NRMlFPVjNxZ21abnMyM1ZYS3owa0VlenlVV2tpbXZsYTNjWFFxN2pnVlRuMGxTNWdUQWpxRl9XUWRpUDRzb3dB?oc=5,"Wed, 15 Apr 2026 07:00:00 GMT",NEGATIVE,0.9894,2026-06-23 01:12:01
bmw_23c199c94c00475f,Audi’s German workers renew opposition to U.S. plant - Automotive News,Automotive News - Competitors,Audi’s German workers renew opposition to U.S. plant - Automotive News. Audi’s German workers renew opposition to U.S. plant Automotive News,https://news.google.com/rss/articles/CBMilgFBVV95cUxQTDUyM1ZqWDZnbVhadlU5MGdJVWQ1SV82RVFXUlRuQ2RZcEtfOXNtU3RNb3BEQm1RS3dzelo2cXFmcGFxdGdiN3NzT2lpSjJROFpWWEdDWlZtdDctanlDR2E1dnE3d0h4N2czYUhFWHJ2NjdIUkhYM282NTJYQ3FieGxfZmJSa05OMmpMUTR3VkdUVWFaY1E?oc=5,"Fri, 30 Jan 2026 08:00:00 GMT",NEGATIVE,0.8981,2026-06-23 01:12:01
bmw_2e2b3a7ae1e64545,"2 paths to profits: BMW favors broad lineup, while Audi aims for lean and focused product range - Automotive News",Automotive News - Competitors,"2 paths to profits: BMW favors broad lineup, while Audi aims for lean and focused product range - Automotive News. 2 paths to profits: BMW favors broad lineup, while Audi aims for lean and focused product range Automotive News",https://news.google.com/rss/articles/CBMimgFBVV95cUxNNjI3Nm9PdEZXX1NBVEFOUUJod2lCWTNQcnZHTWlzY050VE84aURCNDY2WTh1V0ZMRHdnVjBRbzBRSmdhdVhNa2JfdC1OUklKY0JvUUgyY3BrTnBoam0xVTg3Y1BhU3lJd3BZa0hYdndGUGZJQ3EzQ2J0UjQ0UEYxRlJGSUVwM1NmNU1NcnpwUm54cnhMcUdYVVVB?oc=5,"Thu, 18 Sep 2025 07:00:00 GMT",POSITIVE,0.9727,2026-06-23 01:12:01
bmw_c8bcfeb313090de0,"Global Luxury Car Market Outlook | China, India, Europe Lead | BMW, Mercedes-Benz, Porsche Drive Premium Automotive Evolution - PR Newswire UK",Automotive News - Competitors,"Global Luxury Car Market Outlook | China, India, Europe Lead | BMW, Mercedes-Benz, Porsche Drive Premium Automotive Evolution - PR Newswire UK. Global Luxury Car Market Outlook | China, India, Europe Lead | BMW, Mercedes-Benz, Porsche Drive Premium Automotive Evolution PR Newswire UK",https://news.google.com/rss/articles/CBMiiAJBVV95cUxQWF9MMlNXRElpV1JUZnU0Z3BYS2dkUktYVWpVbVlKQ0NPT2pDdFJkVVNySWZHanZzbzcydHpvU0VWRWFqZ29nTEx0el9odEF4VVpxM2Y3VEdxeW4wZGVsNlVHQXZ3Q2lHZXFhMFRQUTN2N1VEeEtJTERsaUFlU3dTaGhYTkVNbEdqeUozQW9ybXB4VloyRko0T2tmbzFheDl4RWUyazM4Z2kzWnVDZmU0RUc2VE9qRGgtVUVUZFJyYnlUS0JDTUUtOXB0QmpRQmpSdW9DaXk4b21sWG9aR3Noam91UnF0NzI2eEFTY09QZ2pvU1lsVWtYWjF5UWlLcE00dTRIdDFYNHo?oc=5,"Wed, 08 Apr 2026 07:00:00 GMT",POSITIVE,0.6515,2026-06-23 01:12:01
bmw_5a602659ff45fa77,Is Tesla Abandoning New Car Production? Unveiling the Surprising Strategy - 36 Kr,Automotive News - Competitors,Is Tesla Abandoning New Car Production? Unveiling the Surprising Strategy - 36 Kr. Is Tesla Abandoning New Car Production? Unveiling the Surprising Strategy 36 Kr,https://news.google.com/rss/articles/CBMiU0FVX3lxTE8xU1BYSlY0NnV4OWFPaFF5bzJUZko2OEhfZGdTRzNkY0hrYjZmODQ4X1hpU0Z5QWFtOHlqT2VxSTg4Q0RhY21Ma2VFZWpnenE3TjlN?oc=5,"Fri, 19 Sep 2025 07:00:00 GMT",NEGATIVE,0.9969,2026-06-23 01:12:01
bmw_ae6129927c438d9d,How BYD Outsells Tesla in Europe Again and Impacts the EU - CBT News,Automotive News - Competitors,How BYD Outsells Tesla in Europe Again and Impacts the EU - CBT News. How BYD Outsells Tesla in Europe Again and Impacts the EU CBT News,https://news.google.com/rss/articles/CBMijwFBVV95cUxPelc0UlFTS1YwVERtakVDczdveF9wWHZDb21JVHp4TGx5SU1vRFNSVlpfWXpHcm96ZEpJcDg5bnlBLTlyaVVRUTk1V0FXTndocUpDZGVDdEhkUmR0dWswTzJwRFg4RldodWxOWjRzb3F2M1QwYlBrb2ZwX3FZbGp4OHByeFYxOHVvNUxLYkptUQ?oc=5,"Thu, 25 Sep 2025 07:00:00 GMT",NEGATIVE,0.9726,2026-06-23 01:12:01
bmw_d7db453c7695a3ea,Tesla's US Electric Vehicle Market Share Plunges to Eight - Year Low - 36 Kr,Automotive News - Competitors,Tesla's US Electric Vehicle Market Share Plunges to Eight - Year Low - 36 Kr. Tesla's US Electric Vehicle Market Share Plunges to Eight - Year Low 36 Kr,https://news.google.com/rss/articles/CBMiU0FVX3lxTFBsSXVzZ0ZzMjJ1REhRUzBqbzNpbzlZdkc0M19ROFRENWllQWVyYmo5UTkyRW5ZdXRYVFRlZEY3WTFicUNJUWxnUjUxb3hzX1FZZXVr?oc=5,"Mon, 08 Sep 2025 07:00:00 GMT",NEGATIVE,0.9992,2026-06-23 01:12:01
bmw_956277e67969f72f,BYD Sales Surges 272% in European Union as Tesla Slumps - CarbonCredits.com,Automotive News - Competitors,BYD Sales Surges 272% in European Union as Tesla Slumps - CarbonCredits.com. BYD Sales Surges 272% in European Union as Tesla Slumps CarbonCredits.com,https://news.google.com/rss/articles/CBMifkFVX3lxTE5zOVkxNDBmaTZnR3BKdGVVZTBKQ3NVSjRISGlhcFVKXzhjeS1GRGZOSmdNaDRBeERCNXNMY3hZbWZ3OTJCMHp3U1VvbTBZZHE3d2ctV1RvMGhxZzBvMmlmWnJiRUJKQU9jZFNCVGF3ZW1waWFYck9NMDFQTDFRZw?oc=5,"Fri, 31 Oct 2025 07:00:00 GMT",NEGATIVE,0.9975,2026-06-23 01:12:01
bmw_4f5ff0e7cb3b5490,BYD vs Tesla: The High-Stakes Investment Battle Reshaping the EV Market - Kavout,Automotive News - Competitors,BYD vs Tesla: The High-Stakes Investment Battle Reshaping the EV Market - Kavout. BYD vs Tesla: The High-Stakes Investment Battle Reshaping the EV Market Kavout,https://news.google.com/rss/articles/CBMiqAFBVV95cUxPRmE4aVEydmtqYWR4U0VYQ1BRNGZ6VFUzSHFXTThzLU5aMzExMEJtTEk1bUFobDFkc0tvb2ItSl9QOWljektMa05pcUh1Zk0wUU1kTVRxUFBzM3J0ZHo4RlhDSFJGYTJ0X2JlSXUwSFpNRW1yX1drQk5WRi1KaGc1cEdtVWZSRGFKNnhaeHhkRlhGOFJtTnUyNTlEd3U3Y01jb1NsLWtZbzE?oc=5,"Tue, 02 Sep 2025 07:42:53 GMT",POSITIVE,0.9975,2026-06-23 01:12:01
bmw_eb9f9a431a8af8e2,Tesla Arrives in India After Years of Negotiations and Delays: India's Automotive Market Size - Spherical Insights,Automotive News - Competitors,Tesla Arrives in India After Years of Negotiations and Delays: India's Automotive Market Size - Spherical Insights. Tesla Arrives in India After Years of Negotiations and Delays: India's Automotive Market Size Spherical Insights,https://news.google.com/rss/articles/CBMipgJBVV95cUxNbWlIV3FhZmFWbzduYTVNVFhLQVZ2VjRicHo4QWR5cjZYbi1IRGllY3NiWWlWWGd3dEJCRWpBT3ZpWDFBaW1qYlZvWTNzc1A0cHpsWDdET2dwRXNiVlpRWnVKQzJiRnk2Sm5NeGtPcW5xTndVMHRXTW04R0pkM1IyUXZXSEdOWmFvQzNGQjdodHRmVFlZSnNCN3JISEM1VnVuTjBTa0VYQVJSVUxVc3B4U0kzUXZYNVlvai1ObUxZMmVWX0QweFlVMmt2WFhFVkcxMDJ0OGRjT2Z3Nk1FY2VaSm5RSzlTbzRxektqSmExbFlTdUtxTmN4dmxpeWQ0WHJELUN3cThyZ1NfLWx2VnZhUi1CeDNNUEx2NTl4aGNLckFpaXhWSGc?oc=5,"Mon, 28 Jul 2025 06:01:30 GMT",NEGATIVE,0.9619,2026-06-23 01:12:01
bmw_92ab904eb0fbd915,Tesla China cuts price of new Model 3 as moment of truth nears - South China Morning Post,Automotive News - Competitors,Tesla China cuts price of new Model 3 as moment of truth nears - South China Morning Post. Tesla China cuts price of new Model 3 as moment of truth nears South China Morning Post,https://news.google.com/rss/articles/CBMiywFBVV95cUxQZFQ2Q0o2ajVVRXVBQTlZRUlQVmYzX255bmhLR1J4YUJTS0ZHNUdtck9hdW8zdk1tYmxHUDJ4Q19XREtzWng0cDdhSkE5Z1B4NDhlek11OXo1WnlXTVZwRGNmVlI3YTNZajhJUWNMV29kdVd3MkIyNlpfanNhV2gyRDdxVkQtbjBIVnE1NzQ0aWszSFpYeW9KQUVjYjhpWXhYbDI5TmV6bzlYcVNrZV9CalVvT0daOGJtQ1RfWXF1ZzFoV0wza0w5S193b9IBywFBVV95cUxNZS1Lc1RHcTAzNk1BZHhkX3F0X0lzLVlZeTkycmlnbWZiS00yV2FWMWx0RkpjUnFndkk3LUtqOUZzeFdkWDFyaFNsRW5ObmJTSzh3anFVVnpDV3R6aXh4TG1qVWFac1pDbUVJZ3lKMlpqU3ZTencwckx5U2s0MEFqb1A4SXJKTXVDLUFQMjdxUS1YSG13dFd6UEFvVFI4Z0U1d2lzRUhFRU5kYmVfc2QwYXhQQ2g2V2E0dXBYRko1SjVmcGdub0hHdkZTTQ?oc=5,"Mon, 01 Sep 2025 07:00:00 GMT",NEGATIVE,0.9981,2026-06-23 01:12:01
bmw_7503fe963c51bdaa,Tesla launches cheapest car model in US: Will the new strategy boost sales amid growth challenges - The News International,Automotive News - Competitors,Tesla launches cheapest car model in US: Will the new strategy boost sales amid growth challenges - The News International. Tesla launches cheapest car model in US: Will the new strategy boost sales amid growth challenges The News International,https://news.google.com/rss/articles/CBMi1gJBVV95cUxOTWJUQUxUTllBWXhZbUNHMnJkOXA3cDRVeUhucGhQZFRBcENUdkNsTGVHSjM5RmVWajR2Nkd4Ni1sZXItbm05OWZraXVQLTRNeG96UjBBYjRIZC1SWEpBUUdYZko3X3k1Vk5mNGFiaUgwYllBYzBSNUhDTjIxcU83b0JDcTRSS0RZenpEQnJFYTNrd1dXZ0Y2amxFNnpRcTNRMDgzZmMyQXp3Y3hyM0ExWW1JZUwwOVVjRXhwZkI1SWw3UUNNZTVfazNWZGRISDdnRGFYYkJpbVo5VTF0OUFoNnZfaVRuTFVPZkF4R2hHa3RoeEZYNGgwRjZlV2pxWUx1SFh6N2ZNaVZZM21YREY0ekcwOUlJbDlwV1BxRUMxbHlYcWt2VTFFN0hkb0hudWpyUXROTkljMm45UF92V3A3SWlvd285NUJ1ZUNTS05mMkV4LURwOEHSAdICQVVfeXFMT2lDQ21GM0RPLXVpdWh6R3ZkXzZINlFucGNKOEpVbk9YakEwODBKc3ppejZySWhQbE8yeWh2LXZoTTlyclJUU2dYaDNjVUJfdzNPbXhrWWFTczh0UWtBbzhqb1RVeHNjNEFtbDRTSEZaYTFBdnMyUnVhSVprQU5PeDcyYXhyZkNfd3B4d3pzOWpiVThuTDk1bG9BaHQ4NjZ0LVVHcENBME1ORmNsbDEwNUxTclBMZnVzZUplNU9qX1doNWlnY19kNHJOZkg5Uk1IQWZYS0RqdHNSVm9mTUpRN2tic3lJeDE4RjZhSVE5NzdmR2s5d0pQLTVpVW1LLU42dmFJbnhwSndfRG10eDdNOHFpaFdDOTZKQ1lMVW5mV1lfdXBvenBsY21CVGRMdzRQNW5UX29JSDd1YTNCWFRGWU96X2ZWM2ZWWmZhQkxfWHJ3aGc?oc=5,"Tue, 03 Feb 2026 08:00:00 GMT",NEGATIVE,0.7168,2026-06-23 01:12:01
bmw_dd3ad8f14f324e38,A Case Study on Tesla's Marketing Strategy - Simplilearn.com,Automotive News - Competitors,A Case Study on Tesla's Marketing Strategy - Simplilearn.com. A Case Study on Tesla's Marketing Strategy Simplilearn.com,https://news.google.com/rss/articles/CBMimgFBVV95cUxNLWszdlRUVlpvdU42bjl5QTdnaENuOFFqZHFvdlZaSzdxVlBMaVJiWVh4dWpxeEoxdGVnZnBTRW5uaXYzVVl5QjVrMU5Lb3ozWkFNa2h2Z2FkMEt5amUtVGtUdy1lN1p6ZW5XN3dseV9ZMXR5Uk1PUTlJdUxlQWhGYlktUldJNEFubjlRNHpOMnIyNm41c3lNRTN3?oc=5,"Tue, 09 Dec 2025 08:00:00 GMT",NEGATIVE,0.7472,2026-06-23 01:12:01
bmw_4332ebbe03c4595c,Tesla gears up to release major Full Self-Driving upgrade next month - CBT News,Automotive News - Competitors,Tesla gears up to release major Full Self-Driving upgrade next month - CBT News. Tesla gears up to release major Full Self-Driving upgrade next month CBT News,https://news.google.com/rss/articles/CBMimAFBVV95cUxORk1JZEluTGpvRlBJeWhjTjFvWFRBYzZ1M0gyRmdTTUlSVmloQVl1UG9WMkRtNmtFRjVaUWhJN1UzYnFEQ3RkTjZZWFM1b240V2pjTFFPaFF6bThGZllTbVphYmRUREFxQXIxYl9aUHhVWmFKdmYtaGJ5bXY0eU5CdFhiQlRGa05ZMU1salpXNXdscU5BRzgxNA?oc=5,"Wed, 06 Aug 2025 07:00:00 GMT",NEGATIVE,0.9313,2026-06-23 01:12:01
bmw_1105f5f01a4dd2eb,"Mercedes-Benz India Declines 2.85% In 2025 As BMW Gains Market Share, Highlighting Strategic Shift - BW Businessworld",Automotive News - Competitors,"Mercedes-Benz India Declines 2.85% In 2025 As BMW Gains Market Share, Highlighting Strategic Shift - BW Businessworld. Mercedes-Benz India Declines 2.85% In 2025 As BMW Gains Market Share, Highlighting Strategic Shift BW Businessworld",https://news.google.com/rss/articles/CBMi4AFBVV95cUxOY3J1YXpvQ3ZNcXAyQjZDUkpLMm9FYlR4dHd3TjRaSE9xXzBvZ3dfMVRsam1oeUxhMUlGOERVcWQ5UDNhZDBITzVwc3p3TGlqV1lWVi1wcXoycUFSMnB0U2VBTVdmdWdxajU5NmNNRkd1Vm1kbzZUX0k0VjdfckUzZENzRkZCbFotRlZtcEdVY21FdEJyOVRxcEFoNXlyLUhjSUxBQ3duWkM3dnkyM3EweThsa0k2MzdxVGowVmE2b1dfVUxmdkhmY3VFcTg1UE81SUtHU1ZseHp4cTdVc2oycA?oc=5,"Sun, 18 Jan 2026 08:00:00 GMT",NEGATIVE,0.9947,2026-06-23 01:12:01
bmw_626b10e74a6a1005,"BYD builds its cars for Australia in just 52 seconds. Next, the world - AFR",Automotive News - Competitors,"BYD builds its cars for Australia in just 52 seconds. Next, the world - AFR. BYD builds its cars for Australia in just 52 seconds. Next, the world AFR",https://news.google.com/rss/articles/CBMiwAFBVV95cUxNUGo2M1RkRjZNRU9YVm1QeVZWbE5NRzZzWkt2NDlXQ2hVYk5vRmd6NWZOY3JlTFVUTnhzamhyNFJNWUozaFFXNlNYTVNBUjNmZWhPUTVUcmh3TzhUMk9LN0gyUnJydnM3aC0wakFzZ2FSSmRQRXljcjh3UE5BbzNlQ0tNaWpwOHlJTWcxLTd2aTF2RTAwUDJBU1ZRaUhId1FKNHoybGRQZ2NRYjd1V0dKczdoNXBhQ0hSSF9CNm0xcXI?oc=5,"Fri, 09 Jan 2026 08:00:00 GMT",NEGATIVE,0.9888,2026-06-23 01:12:01
bmw_83b26ac6f2d18fc0,Tesla finally enters India after a decade of false starts - Rest of World,Automotive News - Competitors,Tesla finally enters India after a decade of false starts - Rest of World. Tesla finally enters India after a decade of false starts Rest of World,https://news.google.com/rss/articles/CBMibEFVX3lxTFBvcEJlM05Ic3hCOVpBbUlvYVp3TnhyRlBoRTBBVHR2bEEtajNvM1MyUm1FTE9jRHN3Sk0yNFpfWWtVajNWc1FidXhzVVBSY2hLdlg1dlBUUFpMYWRXX0FGUXZVc0pYV1VUYnBVcQ?oc=5,"Wed, 16 Jul 2025 07:00:00 GMT",POSITIVE,0.6018,2026-06-23 01:12:01
bmw_e3adcef13bd7db2f,Mercedes keeps ‘value over volume’ approach in tough Chinese market - The Business Times,Automotive News - Competitors,Mercedes keeps ‘value over volume’ approach in tough Chinese market - The Business Times. Mercedes keeps ‘value over volume’ approach in tough Chinese market The Business Times,https://news.google.com/rss/articles/CBMizgFBVV95cUxOcXQ1MjJJa3hmQ194Snh2bHoyd0FJY1E1MDM0b0RUT3N3dHVSbnQwcnpLZHUzeG55YlV3Tk94R2RheElROWUwS1M5cmtOYlZBSTVUakZlWmpfU2JDcXhjeTNwdWZkWDh6enVXSXQ1TVQwWnJfc0dDU3NxbXk0N1Z4WHNhOTU4aWtvd1NjOVhkR1RzeE9qSldOTTR4U3RFVHZ0dzZSQ3VNMjhEdXZJSTktV21CZE9Ld3oyY1pBMEZhYUdoNF9ZTWFUTUppeXQxdw?oc=5,"Mon, 08 Sep 2025 07:00:00 GMT",POSITIVE,0.7243,2026-06-23 01:12:01
bmw_3c2909877ba2bf1d,Hyundai Motor set to revamp software strategy amid Tesla's FSD launch - The Korea Times,Automotive News - Competitors,Hyundai Motor set to revamp software strategy amid Tesla's FSD launch - The Korea Times. Hyundai Motor set to revamp software strategy amid Tesla's FSD launch The Korea Times,https://news.google.com/rss/articles/CBMiwwFBVV95cUxOam92b2c5dVY5XzJZWnpoMUhjSkplbjVZbHhQd1E3cWhuLWNFamw0U3A5RE9KU1lZWWVQVWdCS25oUWN2ejVJZDNMT1hWMkRWeXVfNG1Cd1dBSXRINk1sYlgta0VHSFRSVWtTUEhBc3NtQ1RGdFhTRW9nNWhHb3duN2dzaUtFYkgwNnhqSUdDRFFtZUR3Wml3R09QTklzUjZpalBXWTE3N3NObnRlM3cyUjNiMU1YYWNnVlVSaE4xOG1keU3SAcgBQVVfeXFMTVJxejdxUWpCUkpLYnl0SU55cnNGRFRlTzI5dGFydkhkeUZhbFF0ajE2Z3kxX0prd1BmM1dYdjhDVGNzOXoxampiWHVOWjZmMlhPSDZ4ZlNlTFpWczN3YzJvX3FaZ2hqMG05VVNqOVhxOWRpdjFxNGZ0YzZFbGVtTTAyUVVrXy00dlV3dmJadlBhbnRRSUtNdVlLX1lZUm8wUmpLZ2ZDMXZoRzlyZmpKc215d2tDTEFkckpzc1lLMGZoWUc2LVpHUC0?oc=5,"Thu, 04 Dec 2025 08:00:00 GMT",NEGATIVE,0.9936,2026-06-23 01:12:01
